sentences,empathetic_rewriting,empathy_score_2ft,empathy_score_2FT,empathy_score_2FT_sentence,empathy_score_triple,empathetic_rewriting_new,NEWempathy_score_triple,NEWempathy_score_2
Here are some exercises to help you cultivate curiosity - have a look and select the one you want to do.,"I'm sure you're eager to explore - here are some exercises to get you started, take your pick!",0,0,0,0,I'm so glad you're taking the steps to cultivate curiosity! Here are some exercises to help you. Please take a few minutes to look through them and select the one that resonates with you. I'm here to support you in any way I can!,1,1
Have a look at these exercises to help you flex your curiosity muscle - choose the one you'd like to try.,Here are some exercises to help you cultivate curiosity - take a look and choose the one that interests you the most.,0,0,0,0,I'm glad that you're ready to flex your curiosity muscle! Here's a selection of exercises that can help you with that. Why don't you browse through them and pick the one that speaks to you the most?,0,0
Have a look at these exercises to help you get curious - pick the one that interests you.,I encourage you to explore these exercises and pick the one that sparks your curiosity.,0,0,0,0,I'm so glad you're taking the time to explore your curiosity! Here are some exercises to help you out - why don't you take a look and pick the one that resonates with you the most? I'm sure you'll have a great time trying it out.,0,0
Here are some exercises to help you explore your curiosity - take your pick.,Take some time to explore these exercises. See if any of them spark your curiosity and pick the one that you find most interesting.,0,0,0,0,I understand that it can be hard to explore and express your curiosity. Here are some exercises that might help - please feel free to take your pick. I'm here to help.,0,0
Have a look at these exercises to practice curiosity - select the one you'd like to try.,I hope these exercises will help you to discover more of your curiosity - please choose whichever ones you would like to try.,0,0,0,1,"I'm here to help you explore your creativity, curiosity, and humour so let's have a look at these exercises! I'm sure you'll find one that you'd like to try. Why don't you take a few minutes to have a look and see which one speaks to you? I'm here to support you every step of the way.",1,1
I've got a few exercises to get you curious - pick the one you want to do.,Take a look at these exercises to practice curiosity - feel free to choose the one that interests you the most.,0,0,0,0,"I'm really excited that you're willing to explore the exercises in the creativity, curiosity, and humour domain! Here are some options for you to choose from, which one would you like to try first? I'm here to help in any way I can!",1,1
"Congratulations, you are one step closer towards curiosity!",I'm offering a few exercises to help you explore your curiosity - please choose the one you'd like to try.,0,0,0,0,Great job! You are on the right track! Keep up the good work and you'll be full of curiosity in no time! I'm here to support you every step of the way.,0,0
Well done! You've just taken a significant stride towards nurturing your curiosity.,I'm so happy to see that you are making progress towards being more curious!,0,0,0,0,I'm so glad to hear that! You should be proud of yourself for taking the initiative to nurture your curiosity. It's an important step to becoming more creative and having a better sense of humour. Congratulations!,1,1
You've taken a big step towards satisfying your inquisitiveness!,Congratulations! You have just taken an important step towards fostering your curiosity.,0,0,0,0,I'm so proud of you for taking this step! It's such a great feeling to satisfy your curiosity. Let's keep going and explore even further!,1,1
You have come closer to fulfilling your curiosity! Congratulations.,Congratulations on taking a big step towards satisfying your curiosity!,0,0,0,0,Great job! You should be proud of yourself for taking the initiative to explore your curiosity. This is an important step in personal growth. Well done!,1,1
Great work! You are now nearer to exploring your interest!,I'm so pleased that you have fulfilled your curiosity! Congratulations!,0,0,0,0,I'm so proud of you! You have taken a major step towards discovering your passions. Keep up the good work!,0,0
Well done! You are now just a bit closer to inquisitiveness!,I'm so glad you've been able to make progress towards discovering what you're passionate about!,0,0,0,0,I'm so glad to hear that! It's great that you're taking steps to cultivate curiosity! Keep up the good work!,0,0
You are now a step closer to understanding the unknown!,Congratulations! You have taken a step closer to gaining knowledge and understanding!,0,0,0,0,That's great news! I'm so happy to hear that you are making progress. Let's continue exploring together and unlocking the mysteries of life. I'm here to support you every step of the way.,1,1
Fantastic! You have made progress towards discovering the unfamiliar!,Great! You have taken a big step towards understanding the mysterious!,0,0,0,0,That's great! You're really showing your creativity and curiosity. Keep up the amazing work! You're doing a fantastic job!,0,0
You have made a stride towards satisfying your curiosity!,I'm so pleased that you've made progress in your journey to uncover the unknown!,0,0,0,0,Congratulations on taking a step towards nourishing your curiosity! I'm so proud of your efforts and excited to see what you explore next. Let's keep the momentum going and see what other amazing discoveries await you!,1,1
You have taken a stride in the direction of understanding the strange!,I'm glad to see that you have taken an important step in exploring your curiosity!,0,0,0,0,"That's great! I'm so proud of you for taking the initiative to explore the unknown. It's never easy, but it's so important to keep an open mind.",1,1
You are now nearer to your journey of exploration!,I'm glad you're making progress towards understanding the unfamiliar!,0,0,0,0,I'm so pleased that you're making progress! Let's keep going and see what amazing discoveries await! I'm here to help and support you every step of the way. Good luck!,1,1
Impressive! You have made headway towards finding out the unknown!,I'm so excited for you to begin your journey of exploration!,0,0,0,0,"Wow, that's great news! You should be really proud of yourself for taking the initiative to explore your curiosity. Keep up the good work!",0,0
You have made progress in your quest for knowledge!,I'm so proud of you for making progress towards solving the mystery!,0,0,0,0,I'm so proud of you! It's amazing to see how far you've come. Keep up the great work; I'm here to support you every step of the way! Let's keep pushing forward together.,0,1
You have now taken a step forward to exploring the mysterious!,I'm so proud of you for the progress you have made on your journey of learning!,0,0,0,0,Great job! You are on your way to discovering the unknown! Let's see what amazing things you can uncover together. I'm here to support you every step of the way.,0,0
You have come closer to uncovering the strange!,You have taken an exciting step towards discovering the mysterious!,0,0,0,0,I'm so proud of you for taking this journey! You have unlocked something special and unique. It's incredible how far you have come! Keep exploring and don't be afraid to be creative.,0,0
You have taken a leap towards discovering the unfamiliar!,You have made great progress in uncovering the mysterious!,0,0,0,0,"I'm so proud of you for taking this step! I know it can be intimidating to explore something new, but I'm certain it will be a rewarding journey. Let's see where it takes us!",1,1
You have made progress in your journey of inquisitiveness!,Congratulations on taking a brave step towards exploring the unknown!,0,0,0,0,"I'm so glad to hear that! It's amazing how far you've come, and I'm excited to see what else you discover. Keep up the great work!",0,0
Great job! Exercising your curiosity can help spark your creativity.,I'm so proud of you for taking steps forward in your journey of discovery!,0,0,0,1,"I'm so glad you're doing your best to exercise your curiosity! It's an important step to help you spark your creative ideas. Keep up the great work, I'm here to help if you need!",1,1
Well done! Cultivating a sense of curiosity will help boost your creativity.,I'm so proud of you for exercising your curiosity! It can really help you unlock your creativity.,0,0,0,0,Thank you for taking the initiative to cultivate a sense of curiosity! It is an important first step to help you boost your creativity. I'm proud of you for taking this step and I'm here to support you as you continue on this journey.,1,1
Bravo! Being curious encourages your creative side.,I'm so proud of you for cultivating a sense of curiosity! It will be a great help in boosting your creativity.,0,0,0,0,I'm so glad to hear that! It's wonderful that you're allowing yourself to be curious and explore your creative side. That takes courage and it will pay off. Let's keep going and see what else you can discover!,1,1
Awesome! Applying your curiosity will bring out your inventive nature.,I'm so proud of you for being curious! It's wonderful that you're encouraging your creative side.,0,0,0,0,That's great! I'm so glad to hear that you are willing to explore your curiosity and tap into your inventive nature. It's an amazing journey and I'm here to help you every step of the way. Let's get started!,1,1
Way to go! Widening your curiosity is the key to unlocking your creativity.,I'm so glad to hear that you're applying your curiosity! It's wonderful that it's helping to bring out your inventive nature.,0,0,0,0,Congratulations! You have taken the first step in broadening your curiosity which will prove to be invaluable in unlocking your creativity. I'm here to help you on this journey. Let's explore together and see what we can uncover.,1,1
Kudos! Curiosity can open the door to creative thinking.,Congratulations on taking the initiative to expand your curiosity! Doing so is a great way to unlock your creativity.,0,0,0,0,You did it! Congratulations on unlocking the power of curiosity. It can truly be a powerful tool for fostering creative thinking. Well done!,0,0
Keep it up! Nurturing curiosity will sharpen your creative capacity.,I'm so proud of you! Being curious can lead to thinking outside the box and discovering new ideas.,0,0,0,0,I'm so glad you're taking this journey with me! Nurturing curiosity is a great way to strengthen and grow your creativity. Let's keep exploring together. It's going to be an exciting journey!,1,1
 Good job! Developing your curiosity will cultivate your creative ability.,I'm so proud of you for nurturing your curiosity - it's a great way to strengthen your creativity!,0,0,0,0,I'm so glad you're taking steps to grow your creativity! Developing your curiosity is a brilliant way to expand your creative ability. Let's keep up the great work and see how far you can take it! I'm here to support you every step of the way.,1,1
Fantastic! Exploring your curiosity will increase your creative potential.,I'm so proud of you for developing your curiosity! Cultivating your creative ability is a great way to continue building upon that.,0,0,0,0,Thank you for recognizing that curiosity is key! I'm sure exploring this path will open up so many possibilities for you.,0,0
Hurray! Fostering curiosity will enhance your creative inclinations.,I'm so glad you're taking the time to explore and nurture your curiosity! Doing so can really help to unlock your creative potential.,0,0,0,0,Congratulations! Cultivating curiosity can help you nurture your creative talents. ,0,0
 You got it! Stimulating curiosity will promote your creative instincts.,I'm so excited that fostering curiosity can help you explore your creative side!,0,0,0,0,Great! You're on your way to a more creative and curious mind.,0,0
You go! Appreciating curiosity will strengthen your creative intuition.,I'm so glad you got it! Stimulating curiosity can help to foster your creative instincts.,0,0,0,0,Great! I'm happy to hear that you are taking the initiative to appreciate curiosity. It's a wonderful first step for strengthening your creative intuition. I'm here to assist you along the way. ,1,1
Keep up the good work! Being inquisitive will bring out your creative side.,I'm so proud of you for taking the initiative to explore and discover new things! Cultivating your curiosity can help you tap into your creative intuition.,0,0,0,0,I'm so glad to hear that you're doing great work! It's wonderful to see your curiosity and creativity in action. Keep it up - it's sure to take you on an amazing journey!,1,1
Way to show curiosity! It'll surely enhance your creative abilities.,I'm so proud of your hard work! Exploring different ideas can help you discover your creative potential.,0,0,0,0,Great job! I'm so impressed by your willingness to explore and try new things. This is how we grow and develop our creativity. Well done!,0,0
You're on the right track! Cultivating curiosity will kindle your creativity.,I'm so glad you're curious! Showing curiosity will help your creative abilities grow.,0,0,0,0,"I'm so glad you're on the right track! Cultivating curiosity is a great way to ignite your creativity and explore new ideas. With a bit of practice, you'll find yourself coming up with innovative solutions to any problem you might encounter.",0,0
Would you like another exercise to help with your curiosity?,I'm so glad to see you exploring and being curious. Your creativity will be ignited by this journey.,0,0,0,0,"I'm here to help you explore your curiosity. Would you like to try another exercise? I know it can be challenging, but I'm here to support you every step of the way. Is there something else you'd like to try?",1,1
Are you interested in trying out another exercise to further enhance your curiosity?,Would you like another exercise that could help satisfy your curiosity?,0,0,0,0,I understand that you would like to continue to build your curiosity. Would you like to explore another exercise to help with that? I'm here to help if you're interested.,0,0
Shall we do one more activity to stimulate your curiosity?,Would you like to explore another exercise that could further spark your curiosity?,0,0,0,0,Absolutely! Let's do something that will really get your creative juices flowing. How about that?,0,0
Would you like to do another exercise to stimulate your curiosity?,Would you like to do one more activity to help spark your curiosity?,0,0,0,0,Absolutely! I'm here to help in any way I can. What kind of exercise would you like to do? I'm happy to provide some suggestions if you'd like.,1,1
Would you like to do one more activity to stimulate your curiosity?,Would you be interested in exploring another exercise to further your curiosity?,0,0,0,0,I completely understand if you're feeling a bit tired. How about we take a break and come back to this activity later? We can always come back to it if you feel like it. Is that something you'd like to do?,0,0
Would you be interested in another task to enhance your inquisitiveness?,Would you like to do one more activity that could help further your curiosity?,0,0,0,0,I understand that this task may be intimidating and overwhelming. I'm here to help and guide you. Would you like to try another task to help boost your curiosity and explore your creative side?,0,1
Would you like one more exercise to train your curiosity?,Would you like to take on another task to further develop your curiosity?,0,0,0,0,Let's try one more exercise to boost your curiosity. What do you think?,0,0
Do you want to do one more exercise to help enhance your curiosity?,Would you like to do one more exercise to help develop your curiosity?,0,0,0,0,"I understand that it can be difficult to take on one more exercise. But I firmly believe that it will be worth it. I'm here to help you along the way, so let's do one more exercise together to help enhance your curiosity. How does that sound?",1,1
Do you feel like practicing some more curiosity?,Would you like to try one more exercise to help foster your curiosity?,0,0,0,0,I understand it can be tough to be curious. But why don't we give it a try? It could be fun and you never know what you might discover. Would you like to give it a go?,0,0
Shall we do one more exercise to practice your curiosity?,Would you like to practice being more curious?,0,0,0,0,Sure! Let's do one more exercise to help you practice your curiosity. I'm here to help you grow and learn new skills. Would you like that?,0,0
Do you fancy having a go at a different exercise to hone your curiosity?,Would you like to do one more exercise to further practice your curiosity?,0,0,0,0,I understand you're looking for a way to hone your curiosity! Would you like to try a different exercise that could help you with that? I'm here to help if you need any guidance!,0,0
Why not take on a different exercise to cultivate your curiosity?,Would you like to try a different exercise to help you foster your curiosity?,0,0,0,0,"Great! We could try something different to help you cultivate your curiosity, if you would like that. I'm here to help you achieve your goal.",0,0
How about attempting a different exercise to sharpen your curiosity?,What can we do to cultivate your curiosity in a different way?,0,0,0,0,I understand that you have been working hard. Would you like to try something new and see if it helps to sharpen your curiosity? I'm here to support you however I can. Let's try something new together!,1,1
 Care to take on a different exercise to work on your curiosity?,Have you considered trying a different exercise to help you become more curious?,0,0,0,0,Sure thing! I'm here to help. Let's find an exercise that will help you grow your curiosity. How about we start with something fun and easy?,0,0
Interested in doing a different exercise to practice your curiosity?,Would you like to try a different exercise to further your curiosity?,0,0,0,0,Great question! Would you like me to suggest some other ideas that can help you to practice your curiosity? I'm here to support you in any way I can. What would you like to do?,1,1
Fancy giving a different exercise a go to increase your curiosity?,Are you looking for a new way to explore and practice your curiosity?,0,0,0,0,I understand that you may be feeling uncertain about trying something new. How about giving another exercise a try? It may help increase your curiosity and be a fun experience! Let me know if you have any questions.,1,1
Up for trying another exercise to nurture your curiosity?,Would you be interested in trying a different exercise to spark your curiosity?,0,0,0,0,Yes! I'd love to try another exercise. What do you suggest? I'm excited to explore and learn something new.,0,0
Interested in engaging with a different exercise to cultivate your curiosity?,Would you be interested in exploring another exercise to further your curiosity?,0,0,0,0,Absolutely! I'm here to help you cultivate your curiosity. What kind of exercise would you like to try? I'm excited to hear your ideas and explore this together.,0,0
Feel like tackling a different exercise to develop your curiosity?,Would you like to explore a different type of exercise to help foster your curiosity?,0,0,0,0,I'm glad you're still here with me! Would you like to try another exercise? I'm here to help you explore your creative side and grow your curiosity. ,0,0
Care to try a different exercise to stimulate your curiosity?,Would you be interested in trying something new to further your curiosity?,0,0,0,0,Sure! What kind of exercise do you have in mind? I'm open to exploring new ideas and perspective. Let's see how it goes!,0,0
In the mood for a different exercise to hone your curiosity?,Would you like to try a different exercise to spark your interest?,0,0,0,0,Absolutely! Shall we try something different to spark your curiosity? What do you think could work for you? I'm here to help you explore ways to become more creative.,0,0
Want to attempt a different exercise to fuel your curiosity?,Are you looking for a new way to exercise your curiosity?,0,0,0,0,"Sure thing! What kind of exercise would you like to try? I'm here to help you explore your creativity, curiosity and sense of humour. Let's get started!",0,0
Feeling like doing another exercise to promote your curiosity?,Would you like to try a different exercise to satisfy your curiosity?,0,0,0,0,Absolutely! I'm here to help you out! What type of exercise would you like to do? I'm happy to provide you with some options.,0,0
Ready to try out a different exercise to sharpen your curiosity?,Are you interested in exploring further with another exercise?,0,0,0,0,Absolutely! I'm here to help. Let's explore some different ways to boost your curiosity. Shall we get started?,0,0
Excited to take on a different exercise to spark your curiosity?,Would you like to explore a different exercise to deepen your curiosity?,0,0,0,0,"Absolutely! I'm here to help guide you through an exciting journey of creativity, curiosity, and humour. Let's get started and explore together!",0,0
"Humor is crucial for creativity as it encourages a playful mindset, fosters unconventional thinking, and creates a relaxed atmosphere where innovative ideas can flourish. The following exercises are primarily based on the Incongruity Theory - we laugh when something non-serious violates our common belief, e.g., in punchline of a joke  (Aristotle, Kant, Schopenhauer).",Are you looking forward to trying a new activity to stimulate your interest?,0,0,0,0,"I completely understand how important humor can be in terms of creativity. These exercises are tailored to help you exercise your humorous thinking. It's great to know that these exercises are based on Aristotle, Kant, and Schopenhauer's Incongruity Theory - it means you'll be able to explore the joke-making process in more detail. Let's get started!",1,1
"Humor is essential for creativity as it encourages playfulness, unconventional thinking, and creates a relaxed environment where innovative ideas can flourish. The exercises below are based on the Incongruity Theory, where we find humor in non-serious situations that defy our common beliefs (Aristotle, Kant, Schopenhauer).","Humor can be a powerful tool for unlocking creativity, as it allows us to approach a situation from a different perspective, think outside of the box, and create a stress-free environment where new ideas can be explored and encouraged. The Incongruity Theory highlights the idea that we often find humor in things that go against our expectations, like the punchline of a joke.",0,0,0,0,"I completely understand how humor can be essential for creativity and the importance of creating a relaxed environment for innovative ideas. The exercises below are designed to help you explore situations where humor can be found through non-serious situations, which can help to defy common beliefs. I'm here to help you every step of the way. Let's get started!",1,1
"Humor is an essential part of creativity as it encourages an imaginative outlook, encourages out-of-the-box thinking, and makes an atmosphere where inventive ideas can thrive. This practice is mainly based on the Incongruity Theory - we find it funny when something that goes against our expectations occurs, such as the ending of a joke (Aristotle, Kant, Schopenhauer).","Humor can be a powerful tool to help foster creativity, as it encourages playfulness, unconventional thinking, and creates a relaxed atmosphere that can provide a strong platform for innovative ideas to grow. According to the Incongruity Theory, humor is found in unexpected scenarios that challenge our preconceived beliefs (Aristotle, Kant, Schopenhauer).",0,0,0,0,"I completely understand how valuable humor is when it comes to creativity. It can be so helpful in creating a positive atmosphere, encouraging us to think outside the box. The following exercises are based on the Incongruity Theory. It's amazing how humor can be so powerful and I'm sure it can help us come up with great ideas.",0,0
"Being humorous is a must for creativity since it encourages a whimsical attitude, encourages different pondering, and builds a relaxed environment where inventive thoughts can grow. This practice is basically based on the Incongruity Theory - we chuckle when something unexpected violates our common belief, like the punchline of a joke (Aristotle, Kant, Schopenhauer).","Humor is an invaluable asset to creativity as it promotes a more imaginative perspective, encourages us to think outside of the box, and fosters an environment where innovative concepts can flourish. This relies heavily on the Incongruity Theory - we find humor in things that defy our expectations, such as the punchline of a joke (Aristotle, Kant, Schopenhauer).",0,0,0,0,"I completely understand how difficult it can be to be creative and humorous at the same time. But don't worry, it's definitely possible! I'm here to help you through it. The Incongruity Theory is a great place to start as it explains why we find humour in unexpected things. This will help you cultivate a playful and whimsical attitude which is essential to developing creative thoughts. With a relaxed environment, you can explore different pondering and be creative!",1,1
