sentences,empathetic_rewriting,empathy_score_2ft,empathy_score_2FT,empathy_score_2FT_sentence,empathy_score_triple,empathetic_rewriting_new,NEWempathy_score_triple,NEWempathy_score_2
Well done! You've just taken a significant stride towards nurturing your curiosity.,I'm so happy to see that you are making progress towards being more curious!,0,0,0,0,Good for you! This is a big step in the right direction. Why not take it a step further and try out some fun activities to explore your curiosity even more?,1,1
You've taken a big step towards satisfying your inquisitiveness!,Congratulations! You have just taken an important step towards fostering your curiosity.,0,0,0,0,Great! I'm glad to see you taking initiative. Let's keep this momentum going and work through a few exercises to help you get the most out of this new journey. Shall we?,0,0
You have come closer to fulfilling your curiosity! Congratulations.,Congratulations on taking a big step towards satisfying your curiosity!,0,0,0,0,Great job! You're one step closer to understanding more. Let's keep going!,0,0
Great work! You are now nearer to exploring your interest!,I'm so pleased that you have fulfilled your curiosity! Congratulations!,0,0,0,0,That's wonderful! You are taking steps towards discovering your passion! What's the next step you want to take?,0,0
Well done! You are now just a bit closer to inquisitiveness!,I'm so glad you've been able to make progress towards discovering what you're passionate about!,0,0,0,0,Great job! You are now one step closer to being curious! Let's keep going and see how deep your inquisitiveness goes! Shall we?,0,0
You are now a step closer to understanding the unknown!,Congratulations! You have taken a step closer to gaining knowledge and understanding!,0,0,0,0,Great! It's wonderful that you have taken a step towards understanding the unknown. Let's keep going and explore more together. What else would you like to know?,1,1
Fantastic! You have made progress towards discovering the unfamiliar!,Great! You have taken a big step towards understanding the mysterious!,0,0,0,0,That's great to hear! Keep up the good work and you'll be able to reach your goal soon. Let me know if you need help with anything.,0,0
You have made a stride towards satisfying your curiosity!,I'm so pleased that you've made progress in your journey to uncover the unknown!,0,0,0,0,"Great job! You should be proud of yourself. Now, let's keep building on that progress.",0,0
You have taken a stride in the direction of understanding the strange!,I'm glad to see that you have taken an important step in exploring your curiosity!,0,0,0,0,"Great job! You're making progress! Now, let's work on taking it one step further.",0,0
You are now nearer to your journey of exploration!,I'm glad you're making progress towards understanding the unfamiliar!,0,0,0,0,Great! I'm here to help you every step of the way. Let's take this journey together and make the most of it. What would you like to explore first?,0,0
Impressive! You have made headway towards finding out the unknown!,I'm so excited for you to begin your journey of exploration!,0,0,0,0,That is wonderful! I'm so proud of the progress you have made. Let's continue to make strides forward and keep exploring this new knowledge.,0,0
You have made progress in your quest for knowledge!,I'm so proud of you for making progress towards solving the mystery!,0,0,0,0,That's great! You're doing a wonderful job. Keep up the hard work and you'll be well on your way to success.,0,0
You have now taken a step forward to exploring the mysterious!,I'm so proud of you for the progress you have made on your journey of learning!,0,0,0,0,Great job! You are now one step closer to unraveling the mysterious. Let's continue the journey together and see what else we can discover!,0,0
You have come closer to uncovering the strange!,You have taken an exciting step towards discovering the mysterious!,0,0,0,0,Great job! You are on the right path. Let's keep exploring together to find out what the strange is. Shall we?,0,0
You have taken a leap towards discovering the unfamiliar!,You have made great progress in uncovering the mysterious!,0,0,0,0,Great job! Taking this leap is a big step. Let's continue this journey together and explore the possibilities. What would you like to do next?,0,0
You have made progress in your journey of inquisitiveness!,Congratulations on taking a brave step towards exploring the unknown!,0,0,0,0,Great job! You should be proud of yourself. Keep up the good work and you'll continue to make great strides.,0,0
Great job! Exercising your curiosity can help spark your creativity.,I'm so proud of you for taking steps forward in your journey of discovery!,0,0,0,1,You're doing a great job! Exploring your curiosity can help ignite your creative juices. Why not try something new and see what happens?,0,0
Well done! Cultivating a sense of curiosity will help boost your creativity.,I'm so proud of you for exercising your curiosity! It can really help you unlock your creativity.,0,0,0,0,Great job! Being curious can be an amazing way to help your creative thinking. Would you like to try some activities to help further your curiosity?,0,0
Bravo! Being curious encourages your creative side.,I'm so proud of you for cultivating a sense of curiosity! It will be a great help in boosting your creativity.,0,0,0,0,"Great job! Being curious helps to unleash your creativity. Why not explore something new today? It could be a new hobby, a new recipe, or something else that sparks your curiosity.",0,0
Awesome! Applying your curiosity will bring out your inventive nature.,I'm so proud of you for being curious! It's wonderful that you're encouraging your creative side.,0,0,0,0,Great! Exploring your curiosity and tapping into your creative side can help you unlock your potential. Let's try some exercises to explore this further.,0,0
Way to go! Widening your curiosity is the key to unlocking your creativity.,I'm so glad to hear that you're applying your curiosity! It's wonderful that it's helping to bring out your inventive nature.,0,0,0,0,That's awesome! Let's explore how to nurture your curiosity and tap into your creativity. Why don't we start with a few exercises that help open up your mind?,0,0
Kudos! Curiosity can open the door to creative thinking.,Congratulations on taking the initiative to expand your curiosity! Doing so is a great way to unlock your creativity.,0,0,0,0,Great job! Cultivating curiosity can help us come up with creative solutions. Why not give it a try? Let's explore some exercises that can help you do that.,0,0
Keep it up! Nurturing curiosity will sharpen your creative capacity.,I'm so proud of you! Being curious can lead to thinking outside the box and discovering new ideas.,0,0,0,0,"Great job! You're on your way to improving your creative capacity. Here's how you can keep going: Ask questions, explore, and experiment. Keep learning and growing!",0,0
 Good job! Developing your curiosity will cultivate your creative ability.,I'm so proud of you for nurturing your curiosity - it's a great way to strengthen your creativity!,0,0,0,0,Great work! Cultivating your curiosity can help you unlock your creative potential. Why don't you try exploring new ideas and see what sparks your imagination?,0,0
Fantastic! Exploring your curiosity will increase your creative potential.,I'm so proud of you for developing your curiosity! Cultivating your creative ability is a great way to continue building upon that.,0,0,0,0,Great! We can work together to uncover your creative potential! Let's get started by exploring things that interest you. What would you like to learn more about?,0,0
Hurray! Fostering curiosity will enhance your creative inclinations.,I'm so glad you're taking the time to explore and nurture your curiosity! Doing so can really help to unlock your creative potential.,0,0,0,0,Great job! Fostering curiosity can help you unlock your creativity. Why not try some new activities or exercises to explore your creative side?,0,0
 You got it! Stimulating curiosity will promote your creative instincts.,I'm so excited that fostering curiosity can help you explore your creative side!,0,0,0,0,Great job! Stimulating your curiosity can help to foster and awaken your creativity. Why not try an exercise to see how it works?,0,0
You go! Appreciating curiosity will strengthen your creative intuition.,I'm so glad you got it! Stimulating curiosity can help to foster your creative instincts.,0,0,0,0,Great! Appreciating curiosity can help you develop your creative intuition. Why don't you try exploring something new and see what happens? It could be a great way to build your creativity.,0,0
Keep up the good work! Being inquisitive will bring out your creative side.,I'm so proud of you for taking the initiative to explore and discover new things! Cultivating your curiosity can help you tap into your creative intuition.,0,0,0,0,I'm glad to hear you're doing well! Exploring new ideas is a great way to stay creative. Maybe you can try out some new exercises to help keep the inspiration flowing?,0,0
Way to show curiosity! It'll surely enhance your creative abilities.,I'm so proud of your hard work! Exploring different ideas can help you discover your creative potential.,0,0,0,0,Great job being curious! This will help you develop your creative skills.  Let's take it a step further and explore some exercises that can help you continue to grow your skills.,0,0
You're on the right track! Cultivating curiosity will kindle your creativity.,I'm so glad you're curious! Showing curiosity will help your creative abilities grow.,0,0,0,0,Great! That's the right attitude! Keep exploring different avenues and ideas. This will help you develop your creative side even further.,0,0
Would you like another exercise to help with your curiosity?,I'm so glad to see you exploring and being curious. Your creativity will be ignited by this journey.,0,0,0,0,Sure! What exercise would you recommend? I'm curious to know.,0,0
Are you interested in trying out another exercise to further enhance your curiosity?,Would you like another exercise that could help satisfy your curiosity?,0,0,0,0,Absolutely! I'm here to help you explore further and expand your knowledge. Shall we continue?,0,0
Shall we do one more activity to stimulate your curiosity?,Would you like to explore another exercise that could further spark your curiosity?,0,0,0,0,Sure! What do you have in mind? How can I help you explore your curiosity?,0,0
Would you like to do another exercise to stimulate your curiosity?,Would you like to do one more activity to help spark your curiosity?,0,0,0,0,Sure! What kind of exercise do you have in mind? I'm curious to learn something new.,0,0
Would you like to do one more activity to stimulate your curiosity?,Would you be interested in exploring another exercise to further your curiosity?,0,0,0,0,Sure! What activity would you suggest? I'm open to anything that could help me explore my curiosity!,0,0
Would you be interested in another task to enhance your inquisitiveness?,Would you like to do one more activity that could help further your curiosity?,0,0,0,0,Sure! What would you like me to do next? I'm excited to learn more!,0,0
Would you like one more exercise to train your curiosity?,Would you like to take on another task to further develop your curiosity?,0,0,0,0,"I understand that you may be feeling exhausted. However, another exercise may help you strengthen your curiosity skills. Shall we give it a try?",0,0
Do you want to do one more exercise to help enhance your curiosity?,Would you like to do one more exercise to help develop your curiosity?,0,0,0,0,Sure - let's do one more exercise! What would you like to do? I'm here to help you make the most of your curiosity.,0,0
Do you feel like practicing some more curiosity?,Would you like to try one more exercise to help foster your curiosity?,0,0,0,0,Sure! Let's explore some ways that you can practice curiosity. What do you think would be a good place to start?,0,0
Shall we do one more exercise to practice your curiosity?,Would you like to practice being more curious?,0,0,0,0,Sure! What type of exercise would you like to do? I'm here to help you explore your curiosity and grow.,0,0
Do you fancy having a go at a different exercise to hone your curiosity?,Would you like to do one more exercise to further practice your curiosity?,0,0,0,0,Sure! Let's give it a try. What kind of exercise do you have in mind?,0,0
Why not take on a different exercise to cultivate your curiosity?,Would you like to try a different exercise to help you foster your curiosity?,0,0,0,0,Sure thing! How about you try something that you're not used to? It'll be a great way to expand your horizons and explore new possibilities.,0,0
How about attempting a different exercise to sharpen your curiosity?,What can we do to cultivate your curiosity in a different way?,0,0,0,0,Sure! Why don't you try out a new exercise that can help you explore and develop your curiosity? I'm sure it will be an interesting and rewarding experience.,0,0
 Care to take on a different exercise to work on your curiosity?,Have you considered trying a different exercise to help you become more curious?,0,0,0,0,Sure! What kind of exercise would you like to try? I'm here to help you explore your curiosity and discover new possibilities. Let's get started!,0,0
Interested in doing a different exercise to practice your curiosity?,Would you like to try a different exercise to further your curiosity?,0,0,0,0,Absolutely! What kind of exercise would you like to try? I'm happy to help you explore different ways to practice your curiosity.,0,0
Fancy giving a different exercise a go to increase your curiosity?,Are you looking for a new way to explore and practice your curiosity?,0,0,0,0,Sure! What exercise do you suggest? How can I make it more interesting?,0,0
Up for trying another exercise to nurture your curiosity?,Would you be interested in trying a different exercise to spark your curiosity?,0,0,0,0,"Sure! How can I help? 

Great! Let's start by exploring your interests. What would you like to learn more about today?",0,0
Interested in engaging with a different exercise to cultivate your curiosity?,Would you be interested in exploring another exercise to further your curiosity?,0,0,0,0,Sure! What kind of exercise would you like to do? I'm here to help you find something that will help cultivate your curiosity. Which sounds the most interesting to you?,0,0
Feel like tackling a different exercise to develop your curiosity?,Would you like to explore a different type of exercise to help foster your curiosity?,0,0,0,0,Sure thing! Let's try something new. What kind of exercise would you like to do? I'm here to help you find an exercise that will best help you develop your curiosity.,0,0
Care to try a different exercise to stimulate your curiosity?,Would you be interested in trying something new to further your curiosity?,0,0,0,0,Sure! What kind of exercise do you suggest? I'm open to anything that will help me learn more.,0,0
In the mood for a different exercise to hone your curiosity?,Would you like to try a different exercise to spark your interest?,0,0,0,0,"Yes, absolutely! Here are some great ways to do so: why not try reading about something you haven't heard of before, or take a few minutes to look up an unfamiliar word in the dictionary? You can also try asking yourself questions about the world around you.",0,0
Want to attempt a different exercise to fuel your curiosity?,Are you looking for a new way to exercise your curiosity?,0,0,0,0,Sure thing! What type of exercise would you like to try? Maybe something creative or physical? Let's get you started on something new!,0,0
Feeling like doing another exercise to promote your curiosity?,Would you like to try a different exercise to satisfy your curiosity?,0,0,0,0,Sure! Let's work on something that will challenge your curiosity. What do you think would be a great exercise for you?,0,0
Ready to try out a different exercise to sharpen your curiosity?,Are you interested in exploring further with another exercise?,0,0,0,0,"Yes, absolutely! Let's get started! What exercise do you recommend?",0,0
Excited to take on a different exercise to spark your curiosity?,Would you like to explore a different exercise to deepen your curiosity?,0,0,0,0,"Yes, absolutely! Let's try something new that will help you get creative and inspired. What do you think sounds fun?",0,0
"Humor is crucial for creativity as it encourages a playful mindset, fosters unconventional thinking, and creates a relaxed atmosphere where innovative ideas can flourish. The following exercises are primarily based on the Incongruity Theory - we laugh when something non-serious violates our common belief, e.g., in punchline of a joke  (Aristotle, Kant, Schopenhauer).",Are you looking forward to trying a new activity to stimulate your interest?,0,0,0,0,It's great that you appreciate the importance of humor for creativity! It helps us think differently and encourages innovation. Let's explore this further with the exercises based on the Incongruity Theory. It suggests that we laugh when something unexpected challenges our common beliefs - like in the punchline of a joke. Let's get started!,0,0
"Humor is essential for creativity as it encourages playfulness, unconventional thinking, and creates a relaxed environment where innovative ideas can flourish. The exercises below are based on the Incongruity Theory, where we find humor in non-serious situations that defy our common beliefs (Aristotle, Kant, Schopenhauer).","Humor can be a powerful tool for unlocking creativity, as it allows us to approach a situation from a different perspective, think outside of the box, and create a stress-free environment where new ideas can be explored and encouraged. The Incongruity Theory highlights the idea that we often find humor in things that go against our expectations, like the punchline of a joke.",0,0,0,0,"I completely understand, humor is a great source of creativity. Here are some exercises based on the Incongruity Theory. They will help you to spot the non-serious situations that lead to humorous outcomes. Have fun exploring and let the ideas flow!",0,0
"Humor is an essential part of creativity as it encourages an imaginative outlook, encourages out-of-the-box thinking, and makes an atmosphere where inventive ideas can thrive. This practice is mainly based on the Incongruity Theory - we find it funny when something that goes against our expectations occurs, such as the ending of a joke (Aristotle, Kant, Schopenhauer).","Humor can be a powerful tool to help foster creativity, as it encourages playfulness, unconventional thinking, and creates a relaxed atmosphere that can provide a strong platform for innovative ideas to grow. According to the Incongruity Theory, humor is found in unexpected scenarios that challenge our preconceived beliefs (Aristotle, Kant, Schopenhauer).",0,0,0,0,"Absolutely! Humor can help us come up with creative ideas. Why not try writing a few jokes and see what kind of ideas they spark? Or, if that doesn't feel like your thing, you could also experiment with the Incongruity Theory - look for unexpected outcomes in everyday situations and see how they could be used in creative ways.",0,0
"Being humorous is a must for creativity since it encourages a whimsical attitude, encourages different pondering, and builds a relaxed environment where inventive thoughts can grow. This practice is basically based on the Incongruity Theory - we chuckle when something unexpected violates our common belief, like the punchline of a joke (Aristotle, Kant, Schopenhauer).","Humor is an invaluable asset to creativity as it promotes a more imaginative perspective, encourages us to think outside of the box, and fosters an environment where innovative concepts can flourish. This relies heavily on the Incongruity Theory - we find humor in things that defy our expectations, such as the punchline of a joke (Aristotle, Kant, Schopenhauer).",0,0,0,0,"Absolutely! Humor can provide many benefits, such as helping you relax and think differently. Have you ever tried incorporating humor into your creative process? It might be a great way to boost your creativity and come up with new ideas. Plus, it's based on an interesting theory - the Incongruity Theory!",0,0
"Having a sense of humor is key for creativity since it inspires a light-hearted attitude, motivates unconventional reasoning, and creates an atmosphere where fresh thoughts can blossom. This practice is largely based on the Incongruity Theory - we laugh when something seemingly insignificant breaks our common belief, e.g., the punchline of a joke (Aristotle, Kant, Schopenhauer).","Having a sense of humor can be a great asset when it comes to being creative, as it can foster a lighthearted attitude, lead to new ways of thinking, and create a relaxed atmosphere that allows for creative ideas to flourish. This has been supported by the Incongruity Theory, which states that we often find humor when something unexpected challenges our preconceived notions, such as the punchline of a joke (Aristotle, Kant, Schopenhauer).",0,0,0,0,"Yes, having a sense of humor is a great way to support creativity. It helps create an atmosphere for fresh thoughts to emerge, as well as encouraging unconventional reasoning. This practice is known as the Incongruity Theory, which explains why we laugh when something unexpected occurs. For example, the punchline of a joke.",0,0
"Humor is a must for creativity as it encourages a playful approach, propels unconventional thinking, and creates a laid-back environment where inventive ideas can take root. This practice is mainly drawn from the Incongruity Theory - we laugh when something non-serious contradicts our common belief, like the conclusion of a joke (Aristotle, Kant, Schopenhauer).","I understand how having a sense of humor is an important factor for developing creativity, as it fosters a more relaxed atmosphere, encourages unconventional thinking, and gives rise to new ideas. This notion is largely supported by the Incongruity Theory - we tend to find humor in things that contradict our expectations, such as the punchline of a joke (Aristotle, Kant, Schopenhauer).",0,0,0,0,"Absolutely! Humor is a great way to get your creative juices flowing. It helps you think outside the box and make the environment more relaxed. Plus, it's based on the Incongruity Theory, which states that humor is created when something unexpected happens. So why not try to bring some humor into your creative process?",0,0
"A sense of humor is important for creativity since it inspires a playful attitude, encourages creative thinking, and makes a atmosphere where innovative ideas can develop. This practice is largely based on the Incongruity Theory - we laugh when something that isn't serious disregards our common belief, such as the finale of a joke (Aristotle, Kant, Schopenhauer).","Humor can be a great source of creativity, as it encourages us to approach things in a lighthearted way, think outside the box, and create an environment where innovative ideas can flourish. This idea of humor is rooted in the Incongruity Theory - when something unexpected or unusual occurs, it can often bring laughter (as discussed by Aristotle, Kant, and Schopenhauer).",0,0,0,0,"Absolutely! Humor helps to encourage a more playful attitude and creative thinking. It also gives us the chance to think outside the box and come up with new, innovative ideas. Plus, it's pretty great to be able to laugh at the unexpected - it's all part of the Incongruity Theory. Try it out for yourself and see how it can help you come up with something new.",0,0
"Humor is fundamental for creativity as it encourages a playful mindset, encourages innovative pondering, and makes a relaxed atmosphere where inventive ideas can unfold. This practice is mostly based on the Incongruity Theory - we laugh when something light-hearted defies our common belief, like the ending of a joke (Aristotle, Kant, Schopenhauer).","Having a sense of humor is important for creativity, as it can bring about a lighthearted attitude that promotes creative thinking and creates an atmosphere where fresh ideas can flourish. This idea is largely based on the Incongruity Theory - we often laugh when something unexpected and not serious disregards our usual expectations, such as the punchline of a joke (Aristotle, Kant, Schopenhauer).",0,0,0,0,Humor can help you tap into your creative side! It can help you think outside the box and create a more relaxed environment for yourself to come up with new ideas. Have you ever noticed how jokes often defy our expectations? This is known as the Incongruity Theory!,0,0
"Having a sense of humor is essential for creativity since it inspires a playful attitude, encourages off-the-wall thinking, and builds an atmosphere where fresh ideas can sprout. This practice is primarily based on the Incongruity Theory - we laugh when something insignificant violates our common belief, such as the conclusion of a joke (Aristotle, Kant, Schopenhauer).","Humor can be a great tool to help foster creativity, as it supports a playful attitude, encourages out-of-the-box thinking, and creates a relaxed environment where inventive ideas can come to life. This is primarily based on the Incongruity Theory - when something unexpected contradicts our preconceived notions, it can be humorous (as seen in the work of Aristotle, Kant, and Schopenhauer).",0,0,0,0,"Yes, having a sense of humour can be very helpful in coming up with creative ideas. It helps us to think differently and come up with innovative solutions. Plus, it can create a more fun and relaxed atmosphere, which can help us to think outside the box. Why don't we try some exercises that can help us to explore the Incongruity Theory?",0,0
