sentences,empathetic_rewriting,empathy_score_2ft,empathy_score_2FT,empathy_score_2FT_sentence,empathy_score_triple,empathetic_rewriting_new,NEWempathy_score_triple,NEWempathy_score_2
"Curiosity can help you fuel your natural drive to explore and discover, stay open, and follow your passion. Staying curious is important for becoming and staying creative. Good news - it can be practiced!","I can't help you with this problem.

I understand how difficult this problem must be for you, and I wish I could be of more assistance.",0,0,0,1,It's great that you recognize the importance of curiosity when it comes to exploring and discovering new things. Staying curious is the key to staying creative. I'm glad you know that curiosity can be practiced too! Let me know if you need any help or support in pursuing your passion and staying curious. I'm always here for you!,1,1
"Curiosity is like a spark that ignites your desire to explore, discover, and stay open to new experiences, allowing you to chase after your passions. Embracing curiosity is key to unlocking your creativity.","It's wonderful that curiosity can help you stay open, explore, and follow your passions. Keeping curious is a great way to stay creative, and the best part is that it can be practiced!",0,0,0,0,It's wonderful that you recognize the importance of curiosity and creativity. Embracing curiosity can open up so many possibilities and help us stay excited about our dreams and ambitions. Let's keep exploring and discovering new things together.,0,0
"Nurturing your curiosity can help you to keep your enthusiasm for exploration, stay open-minded, and go after what you're passionate about.","Cultivating curiosity can open the door to exploration, discovery, and new experiences, helping you to pursue your passions with enthusiasm. Nurturing your curiosity is essential for unleashing your creativity.",0,0,0,1,"I completely understand how important it is to nurture your curiosity! Keeping your enthusiasm for exploration alive, staying open-minded, and pursuing your passions will help you to reach greater heights. Let me help you explore ways to nurture your curiosity.",1,1
Cultivating your curiosity is essential for remaining creative - and the great thing is that it's something you can practice!,"Nurturing your natural curiosity can help you to maintain your enthusiasm for discovering new things, stay open to new ideas, and keep pursuing what you're passionate about.",0,0,0,0,"I completely agree! Developing your curiosity is a great way to stay creative. It's like a muscle - the more you use it, the stronger it gets. Let's practice together!",0,0
"Harnessing your curiosity is the key to staying excited to explore, keep an open mind, and pursue what you're passionate about.","Nurturing your interest is key to keeping your imagination alive - and luckily, it's something you can work on!",0,0,0,0,"I completely understand how you feel! It can be challenging to stay curious and inspired, but it's definitely possible. Let's explore some ways to help you harness your curiosity, keep an open mind, and stay passionate about your pursuits. What do you think would work best for you?",1,1
"You can use your curiosity to fuel your curiosity to investigate and learn, stay receptive, and chase your dreams.","Tap into your curiosity and allow yourself the freedom to explore, keep an open mind, and follow your passions.",0,0,0,0,I'm so glad to hear that you're interested in using your curiosity to explore and learn! It's such a great way to stay open-minded and keep chasing your dreams. I'm here to support you every step of the way. Let me know if you need any help!,1,1
"Capitalizing on your curiosity can help you to maintain your zest for discovery, stay open-minded, and follow your heart.","Your natural curiosity can be a powerful tool to help you explore and discover, stay open to new ideas, and pursue your aspirations.",0,0,0,0,"I understand how important it is to stay curious and open-minded. It can be so beneficial to capitalize on your curiosity to nurture your zest for discovery, learn new things, and follow your heart. Let me know if you would like to continue with the exercises.",1,1
Developing your curiosity is essential to staying creative - and the good news is that it's something you can hone!,"By tapping into your natural curiosity, you can keep your enthusiasm for exploration alive, stay willing to consider new perspectives, and trust your instincts.",0,0,0,0,"I'm so glad to hear you say that! Developing curiosity is a great way to stay creative, and you can do it! It is important to continuously practice and challenge yourself to think differently. With a bit of effort, you can sharpen your curiosity and maximize your creativity.",1,1
"Exploring your curiosity can help you to nurture your natural enthusiasm for exploration, stay flexible, and pursue your interests.",Nurturing your curiosity is essential for remaining creative - and the great news is that it's something you can sharpen!,0,0,0,0,I understand how important it is to stay curious and explore your interests. It is a great way to nurture your natural enthusiasm and stay flexible. Let's take this journey together to grow your creativity and sense of humour. Shall we?,1,1
"Taking advantage of your curiosity is important for staying creative - and fortunately, it's something you can practice!","By nurturing your curiosity, you can fuel your enthusiasm for exploration, stay open to new possibilities, and pursue your passions.",0,0,0,0,Absolutely! Staying curious is key to staying creative. It's something that we can all learn to do. I'm here to help you explore and practice ways to get the most out of your curiosity. Let's get started!,0,0
"Strengthen your curiosity to keep your zeal for discovery, stay open, and go after what you're passionate about.","Exploring your curiosity can be a great way to stay creative - and luckily, it's an activity you can easily practice!",0,0,0,0,I understand how important it is to stay curious and passionate. Let's explore together how we can keep your curiosity alive and your enthusiasm for discovery strong. What do you think?,1,1
"Feeding your curiosity can help you to fuel your natural enthusiasm for exploration, stay flexible, and chase your dreams.",I encourage you to nurture your curiosity and stay open to new experiences. Allow yourself to go after what sparks your passions and continue your journey of discovery.,0,0,0,0,I'm so glad you're feeling excited about exploring new things! Feeding your curiosity is an amazing way to help you stay motivated and open to all the possibilities that life has to offer. It can help you stay flexible and keep dreaming. It's wonderful that you're on this journey!,1,1
Nourishing your curiosity is essential for becoming and staying creative - and the great thing is that it's something you can cultivate!,"Nurturing your curiosity can help you to cultivate your natural enthusiasm for exploration, keep your options open, and pursue your aspirations.",0,0,0,0,I completely agree with you! Cultivating curiosity is a great way to boost your creativity and keep it alive. It can also open up new possibilities that you'd never thought of before. It's a fantastic thing to do!,0,0
"Utilize your curiosity to maintain your enthusiasm for discovery, stay open-minded, and follow your heart.","Nurturing your curiosity can be vital for fostering and sustaining creativity - and fortunately, it's something you can work on and cultivate!",0,0,0,0,"I understand how difficult it can be to stay enthusiastic and curious. My advice is to take a few moments each day to reflect on why curiosity and discovery are important to you. This will help you to stay open-minded and stay true to your heart. Remember, it is okay to be curious and explore new ideas!",1,1
"Fostering your curiosity is key to staying creative - and luckily, it's something you can work on!","Allow your curiosity to spark your enthusiasm for exploration, keep an open mind, and trust your intuition.",0,0,0,0,I totally agree! Developing your curiosity is an important part of staying creative. It's great to know that it's something that you can work on and improve. Let's take some steps together to help you foster your curiosity!,1,1
"Leverage your curiosity to keep your fervor for exploration, stay receptive, and pursue your interests.","Nurturing your inquisitiveness is essential for maintaining a creative mindset - and thankfully, it's something you can cultivate!",0,0,0,0,I understand how challenging it can be to keep up your enthusiasm for exploring and pursuing your passions. Let me help you leverage your curiosity to stay motivated and open to new possibilities. Why don't you take some time to reflect on what interests you? You can make great strides by simply paying attention to your curiosity.,1,1
"Applying your curiosity can help you to sustain your natural enthusiasm for exploration, stay open, and go after what you're passionate about.","By staying curious and open to new possibilities, you can maintain your enthusiasm for discovery and continue to explore the things that interest you.",0,0,0,0,"I understand that applying your curiosity can be challenging. However, I want to assure you that it will help you to maintain your natural enthusiasm and passion. It will also keep you open to new possibilities and help you to pursue the things you are passionate about. Let me know if you would like to continue!",1,1
" Awakening your curiosity can kindle your inherent eagerness, willingness to delve into disparate fields and fascination for pursuing them. Good news - it can also be practiced!","By nurturing your curiosity, you can maintain your excitement for discovery, remain open to new possibilities, and pursue what inspires you.",0,0,0,0,I'm so glad to hear that! Awakening your curiosity can be a great way to explore new things and pursue them with enthusiasm. It sounds like a great way to unlock your creativity and curiosity! It's wonderful that it can be practiced. Can we get started?,1,1
"Stirring up your curiosity can kindle your natural eagerness, willingness to explore different areas and fascination in exploring them.","You have so much potential to explore and learn new things - your curiosity can help kindle your eagerness, willingness to explore different fields and fascination for pursuing them. And the best part is - this is something you can practice!",0,0,0,0,"I completely understand how intimidating it can be to try something new. However, I encourage you to use your curiosity as a tool to explore different areas. It can be really exciting to discover something new and to be challenged in different ways. Let's use your natural eagerness and fascination to discover something amazing!",1,1
"Sparking your curiosity can enhance your innate fervor, openness to unfamiliar territories and zest for delving into them. It can also be exercised!","By encouraging your curiosity, you can ignite your natural enthusiasm for discovery, willingness to experiment with various topics, and fascination with learning more about them.",0,0,0,0,I'm so glad that you're interested in sparking your curiosity! Doing so can help you to explore unfamiliar territories and to have a newfound enthusiasm for them. How wonderful! Exercising this can help you to develop your skills even further!,1,1
"Enhancing your curiosity can kindle your natural excitement, acceptance of various realms and relish for examining them.","I understand how exciting it must be to have your curiosity sparked, and how that can help you explore unfamiliar territories with enthusiasm and energy. You can exercise this curiosity too!",0,0,0,1,I understand how it feels to want to explore and discover new things! Enhancing your curiosity can be an amazing way to do that! It can help you appreciate different perspectives and ignite your passion for discovering new realms. Let's use curiosity to ignite your natural excitement and relish for examining them!,1,1
"Reviving your curiosity can rouse your inborn zeal, receptiveness to dissimilar domains and delight in studying them, thus, being indispensible for creativity. And it can be practiced!","By cultivating your curiosity, you can ignite your innate enthusiasm, open-mindedness towards different fields and enjoyment of exploring them.",0,0,0,0,I'm so glad that you're interested in reviving your curiosity! It's such an important part of being creative and engaging with different topics. Practicing curiosity can help you become more open to different domains and find joy in learning. Let's get started!,1,1
"Keeping curious is key for creativity, openness, and eagerness to delve into new fields, and you can also hone it!","Reviving your curiosity can be a powerful way to tap into your natural enthusiasm, openness to different areas of knowledge, and joy of learning, all of which are essential for creativity. Plus, it's something you can work on and develop!",0,0,0,0,"I completely agree! It's so important to stay curious and keep our minds open. That's the best way to explore new ideas and develop our creativity. Plus, it's a fun and exciting journey!",0,0
"Being curious is paramount for openness, natural interest and intrinsic motivation, as well as imagination, and you can also practice it!","Cultivating curiosity can be a great way to foster creativity, openness, and enthusiasm for exploring new ideas. You can hone this skill to your advantage!",0,0,0,0,"I completely agree that being curious is very important for developing intrinsic motivation, creativity, and imagination. It's wonderful that you want to practice it! Let me know if there's anything I can do to help you in your journey. I'm here to support you!",1,1
"Stirring up your curiosity can ignite your instrinsic motivation, preparedness to explore diverse areas and interest in investigating them. Good news - it can be practiced.","Cultivating curiosity can be immensely beneficial for developing openness, natural interest, intrinsic motivation, and imagination, and it's something you can work on!",0,0,0,0,"Great news! Developing your curiosity can lead to greater intrinsic motivation and a readiness to explore new areas. Plus, it's something that you can practice and get better at over time. Let me know if I can help you get started!",1,1
"Keeping curious is crucial for creativity, since it helps you uncover your innate eagerness for exploration, and you can also improve on it!","It's exciting to know that you can practice stirring up your curiosity, which can help to ignite your intrinsic motivation, preparedness to explore different areas, and interest in researching them.",0,0,0,0,"Keeping a curious attitude is a great way to cultivate creativity. It gives you the opportunity to explore and discover new things. Additionally, curiosity can be developed and improved over time, so you can always learn something new.",0,0
Here are a few exercises to help you practice being curious. Choose one!,"It is so important to stay curious when it comes to creativity, as doing so allows you to uncover your natural enthusiasm for exploration, and you can develop it even further!",0,0,0,0,I'm so glad you're ready to practice being curious! Here are a few exercises that could help you out. Why don't you pick one and give it a try? I'm rooting for you!,0,0
Below are some engaging exercises to help you practice and cultivate curiosity. Select one that resonates with you and give it a go!,I hope you find these exercises helpful as you work on developing your curiosity. Choose whichever one appeals to you the most!,0,0,0,1,I'm so glad you're interested in exploring your creativity and curiosity! Here are some exercises that could help you on your journey. Is there one that stands out to you? Give it a try and see what happens! I'm sure you'll find something inspiring.,1,1
Why not try one of these exercises to help you hone your curiosity?,I invite you to explore the exercises below to practice and nurture your curiosity. Select one that speaks to you and give it a try!,0,0,0,0,I understand that it can be difficult to be curious sometimes. Here's an idea: why don't you try one of these exercises to help you hone your curiosity? It could be a great way to open up new possibilities and explore your creative side. What do you think?,1,1
Here are some activities to help you exercise your curiosity - pick one!,Have you considered trying one of these exercises to help foster your curiosity?,0,0,0,0,Great! It's great that you're looking to exercise your curiosity. Let's explore these activities together and pick the one that you think will be the most enjoyable and beneficial. I'm here to support you every step of the way.,1,1
"To get your curiosity in shape, check out these exercises and give one a go!",We understand that exploring your curiosity can be exciting. Here are some activities to help you on your journey - take your pick!,0,0,0,0,I'm so glad you're ready to get your curiosity in shape! Here are some exercises to get you started. Why don't you try one out and see where it takes you? Let's explore your creativity and explore the possibilities!,0,0
Here are a few activities to get your curiosity working - why not give one a try?,It may be fun to try out one of these exercises to help get your curiosity in shape!,0,0,0,0,I'm so glad you're willing to explore your curiosity! Here are a few activities that could help: why don't you give one a try and see how it works for you? I'm here to support you every step of the way. What do you think?,1,1
Exercising your curiosity? Here are some activities to get you started - pick one!,"I understand that you may be feeling hesitant to try something new, but here are some activities that may spark your curiosity - why not give one a go?",0,0,0,0,Great! Exercising your curiosity is a great way to keep your mind active and come up with unique ideas. Here are some activities to help you get started - why not pick one and give it a try? I'm sure you'll find something that will be fun and stimulating!,0,0
Time to get curious! Give one of these exercises a go.,"If you're feeling curious and want to explore, here are some activities to get you started - why not give one a try?",0,0,0,0,Great! It's time to get creative and curious! Why don't you try one of these exercises? I'm here to support you every step of the way. Let's make this fun and exciting!,0,0
It's curiosity time - here are a few activities to help you out. ,Would you like to try one of these exercises and see what happens? It could be an interesting experience!,0,0,0,0,Great! I'm excited to help you out with activities that can boost your curiosity. Let's get started and have some fun! What would you like to do first?,0,0
Feeling curious? Here are some exercises for you to try.,I'm so excited to get you started - here are some activities that will spark your curiosity!,0,0,0,0,I'm so glad you're feeling curious! Here are some great exercises to get your creative juices flowing and to help you explore your sense of humour. Let's have some fun and see what you come up with!,0,0
Here are some exercises to get your curiosity flowing - pick one and give it a go.,"If you're interested in trying some new exercises, here are some options for you to explore.",0,0,0,0,Great! I'm so glad that you are ready to get your curiosity flowing. Let's take a look at the exercises together and pick one that you feel most comfortable with. I'm here to support you every step of the way. Shall we get started?,1,1
Get curious with these exercises - choose one and get started!,"I understand you may not be feeling motivated to try something new right now, but here are some exercises that could help get your curiosity flowing – why not pick one and give it a go?",0,0,0,0,I'm so excited that you're ready to get creative and curious! Here are some great exercises to help you get started. Why don't you take a look and choose one that excites you? I'm here to support you if you need any help along the way!,1,1
Start exercising your curiosity with these activities - select one!,I encourage you to be curious with these exercises - why not pick one and get going?,0,0,0,0,I understand that you may be feeling a bit hesitant to start exercising your curiosity. Let me help you out. Here are some activities that you can select from. Please pick one that you would like to start with - I'm sure you'll love it!,1,1
Give yourself a curiosity workout with these exercises - choose one!,"If you're feeling curious, why not try out one of these activities and see where it takes you?",0,0,0,0,"I'm here to help you explore your creativity, curiosity, and humour! Let me help you give yourself a curiosity workout with these exercises - why don't you pick one and give it a try? I'm sure you'll enjoy it!",0,0
"To get your curiosity muscles working, try one of these exercises.",Explore your curiosity with these exercises - why not give one a try?,0,0,0,0,I understand that you want to get your curiosity muscles working. Here are some exercises which may help you. Let me know if you need any help along the way!,1,1
"To get your curious side going, check out these exercises and pick one.","To help spark your curiosity, why not give one of these exercises a try?",0,0,0,0,I understand that you're looking to get your creative and curious side going. Here are some great exercises that can help you with that. Why don't you take a look and choose one that feels right for you?,0,0
Get curious with these activities - take your pick and give one a try!,"If you're feeling curious, why not take a look at these exercises and pick one to try?",0,0,0,0,"I'm excited to hear that you're looking to get curious with these activities! Here's your chance to explore and grow in the creativity, curiosity, and humour domain. Why not take some time and give one of these activities a go! I'm sure you'll have a great time.",1,1
Here are some activities to help you practice being curious - choose the one you want to try.,I'm excited to offer you these activities for you to explore. Why not pick one and give it a go?,0,0,0,0,Great! Let's get started! What activity looks interesting to you? I'm here to help.,0,0
Have a look at these exercises to get you in the habit of being curious - pick the one you fancy.,I'm excited to present you with these activities that will help you practice being curious. Please pick out the one you think would be the most interesting to try!,0,0,0,0,I'm so glad that you're taking steps to become more curious! Here are some exercises that could help you. Please take your time to go through them and see which one appeals to you the most. I'm here to help if you need any assistance.,1,1
 I've got these exercises to help you get curious - pick the one that appeals to you.,I encourage you to take a look at these exercises to help you cultivate curiosity - feel free to choose the one that appeals to you the most.,0,0,0,0,I understand that it can feel overwhelming to have to choose from a range of exercises. Let me help you out - take your time to explore each of the exercises and pick the one that resonates with you the most. I'm here to support you all the way!,1,1
I've got a few exercises to help you cultivate curiosity - pick the one you want to do.,I'm here to help you explore your curiosity - please choose an exercise that looks interesting to you.,0,0,0,0,I'm so glad you're ready to explore your curiosity! Here are a few exercises to help you out. Please pick the one that resonates with you the most. I'm here to support you every step of the way.,1,1
Here are some exercises to help you practice curiosity - pick the one that speaks to you.,I'm offering a few exercises to help you cultivate curiosity - please choose whichever one appeals to you.,0,0,0,0,I'm glad you're interested in exploring curiosity! Here are some exercises that might help you. Take a look and see which one resonates with you the most. I'm here to support you on your journey!,0,0
 I've got some exercises here that can help you develop curiosity - take your pick.,Here are some exercises to help you practice curiosity - take your time to find the one that resonates with you.,0,0,0,0,I'm so glad you're here! Here are some exercises that can help you develop your curiosity. I'm here to help you if you have any questions or would like some guidance. Please take your pick and let me know if there's anything else I can do for you.,1,1
I've got a few activities to help you get curious - select the one you'd like to try.,I'm here to offer you some exercises that can help you cultivate your curiosity - take your time to explore which one resonates with you.,0,0,0,0,Great! I'm so excited to hear that. Let me start by asking which activity you're drawn to most? I'm here to help you explore your creativity and curiosity. I'm also here to make sure you have fun while doing it!,1,1
Have a look at these exercises to help you become more curious - choose the one you'd like to try.,I have some ideas that I think might help spark your curiosity - why not pick one to experiment with?,0,0,0,0,I'm so glad you are considering trying out these exercises! I'm sure they will help you become more curious. Why not pick one that sounds the most interesting to you? It can be really fun to experiment and explore something new.,0,0
I've got some exercises here to get you curious - take your pick.,I encourage you to explore these exercises to help increase your curiosity. Pick the one that appeals to you the most.,0,0,0,0,Great! I'm here to help you explore your creative and curious side. Let's start with these exercises. What do you want to try first? I'm here to answer any questions you have and to provide guidance along the way.,1,1
