sentences,empathetic_rewriting,empathy_score_2ft,empathy_score_2FT,empathy_score_2FT_sentence,empathy_score_triple,empathetic_rewriting_new,NEWempathy_score_triple,NEWempathy_score_2
"Curiosity can help you fuel your natural drive to explore and discover, stay open, and follow your passion. Staying curious is important for becoming and staying creative. Good news - it can be practiced!","I can't help you with this problem.

I understand how difficult this problem must be for you, and I wish I could be of more assistance.",0,0,0,1,Great! Staying curious can help you stay creative and motivated. Why not try exploring something new today? You could also take a few minutes to reflect and think about what it is that truly sparks your interest. Have fun!,0,0
"Curiosity is like a spark that ignites your desire to explore, discover, and stay open to new experiences, allowing you to chase after your passions. Embracing curiosity is key to unlocking your creativity.","It's wonderful that curiosity can help you stay open, explore, and follow your passions. Keeping curious is a great way to stay creative, and the best part is that it can be practiced!",0,0,0,0,"I'm glad you recognize the importance of curiosity! It's a powerful tool to help you explore and learn. Why not take a few moments to explore new ideas and activities? You never know what amazing thing you'll discover! And remember, it's ok to be creative and take risks.",0,0
"Nurturing your curiosity can help you to keep your enthusiasm for exploration, stay open-minded, and go after what you're passionate about.","Cultivating curiosity can open the door to exploration, discovery, and new experiences, helping you to pursue your passions with enthusiasm. Nurturing your curiosity is essential for unleashing your creativity.",0,0,0,1,Great! Nurturing your curiosity is a wonderful way to stay engaged and explore. Let's find some exercises that will help you stay passionate and open-minded. Shall we get started now?,0,0
Cultivating your curiosity is essential for remaining creative - and the great thing is that it's something you can practice!,"Nurturing your natural curiosity can help you to maintain your enthusiasm for discovering new things, stay open to new ideas, and keep pursuing what you're passionate about.",0,0,0,0,"Absolutely! Cultivating curiosity can help keep those creative juices flowing. Here are some exercises that can help you on your journey: try something new, explore different ideas, and challenge yourself to think outside the box.",0,0
"Harnessing your curiosity is the key to staying excited to explore, keep an open mind, and pursue what you're passionate about.","Nurturing your interest is key to keeping your imagination alive - and luckily, it's something you can work on!",0,0,0,0,Sure thing! Here are some steps you can take to do that: 1. Make a list of exciting topics that you'd like to explore. 2. Take some time each day to learn something new. 3. Find ways to connect your passions to your work or hobbies. I'm here to support you as you take this journey!,1,1
"You can use your curiosity to fuel your curiosity to investigate and learn, stay receptive, and chase your dreams.","Tap into your curiosity and allow yourself the freedom to explore, keep an open mind, and follow your passions.",0,0,0,0,I'm so glad that your curiosity is helping you learn and explore. It's important to stay open to new ideas and keep pursuing your goals. Let your curiosity be your guide!,1,1
"Capitalizing on your curiosity can help you to maintain your zest for discovery, stay open-minded, and follow your heart.","Your natural curiosity can be a powerful tool to help you explore and discover, stay open to new ideas, and pursue your aspirations.",0,0,0,0,"I'm glad to hear you're curious and open-minded! To help you maintain your zest for discovery, why don't you explore something you're interested in today? Follow your heart and see where it takes you!",0,0
Developing your curiosity is essential to staying creative - and the good news is that it's something you can hone!,"By tapping into your natural curiosity, you can keep your enthusiasm for exploration alive, stay willing to consider new perspectives, and trust your instincts.",0,0,0,0,Absolutely! We can work together to develop your curiosity and let your creativity flow. What exercises can I guide you through to help you hone your curiosity?,0,0
"Exploring your curiosity can help you to nurture your natural enthusiasm for exploration, stay flexible, and pursue your interests.",Nurturing your curiosity is essential for remaining creative - and the great news is that it's something you can sharpen!,0,0,0,0,"I'm glad you're interested in exploring your curiosity! Here are some ways it can help you: it can help nurture your natural enthusiasm for exploration, help you stay flexible, and allow you to pursue your interests. Let's try some exercises together to explore it further!",1,1
"Taking advantage of your curiosity is important for staying creative - and fortunately, it's something you can practice!","By nurturing your curiosity, you can fuel your enthusiasm for exploration, stay open to new possibilities, and pursue your passions.",0,0,0,0,Absolutely! Exploring your curiosity can help you stay creative. Why not try setting aside time each day to explore something new? You can also take a break from your routine and try something different.,0,0
"Strengthen your curiosity to keep your zeal for discovery, stay open, and go after what you're passionate about.","Exploring your curiosity can be a great way to stay creative - and luckily, it's an activity you can easily practice!",0,0,0,0,I'm so glad that you have a passion! It's important to stay curious about your interests and keep exploring. Why not try something new today to help develop your curiosity? You may discover something even more inspiring!,1,1
"Feeding your curiosity can help you to fuel your natural enthusiasm for exploration, stay flexible, and chase your dreams.",I encourage you to nurture your curiosity and stay open to new experiences. Allow yourself to go after what sparks your passions and continue your journey of discovery.,0,0,0,0,I'm glad you're feeling curious! Learning new things can help you expand your horizons and stay open to new possibilities. Why not explore something new today and see where it leads you? You never know what great things can come from following your dreams!,0,0
Nourishing your curiosity is essential for becoming and staying creative - and the great thing is that it's something you can cultivate!,"Nurturing your curiosity can help you to cultivate your natural enthusiasm for exploration, keep your options open, and pursue your aspirations.",0,0,0,0,That's great! Cultivating curiosity is an excellent way to stay creative. Let's explore some ways to do that! What would you like to try first?,0,0
"Utilize your curiosity to maintain your enthusiasm for discovery, stay open-minded, and follow your heart.","Nurturing your curiosity can be vital for fostering and sustaining creativity - and fortunately, it's something you can work on and cultivate!",0,0,0,0,I'm glad to see you're ready to explore and discover new things! Here's how you can make the most of your curiosity: 1. Get curious about the world around you. 2. Stay open-minded and be willing to try new things. 3. Follow your heart and go where it leads you.,0,0
"Fostering your curiosity is key to staying creative - and luckily, it's something you can work on!","Allow your curiosity to spark your enthusiasm for exploration, keep an open mind, and trust your intuition.",0,0,0,0,"Absolutely! Staying curious is a great way to keep your creative juices flowing. Here are some exercises to help you foster your curiosity: 1. Try something new each day. 2. Ask yourself ""why"" five times to any problem. 3. Seek out new experiences, people, and knowledge.",0,0
"Leverage your curiosity to keep your fervor for exploration, stay receptive, and pursue your interests.","Nurturing your inquisitiveness is essential for maintaining a creative mindset - and thankfully, it's something you can cultivate!",0,0,0,0,"I understand that you want to stay curious and explore new things. Here are some exercises you can do to help you stay motivated and engaged. First, make a list of projects that excite you and cultivate your curiosity. Secondly, set aside time each day to explore new topics or ideas. Finally, take action and pursue your interests.",1,1
"Applying your curiosity can help you to sustain your natural enthusiasm for exploration, stay open, and go after what you're passionate about.","By staying curious and open to new possibilities, you can maintain your enthusiasm for discovery and continue to explore the things that interest you.",0,0,0,0,Great! Applying your curiosity will help you to keep exploring and remain open to new ideas. It will also help you to find what you're passionate about and follow it. What do you think?,0,0
" Awakening your curiosity can kindle your inherent eagerness, willingness to delve into disparate fields and fascination for pursuing them. Good news - it can also be practiced!","By nurturing your curiosity, you can maintain your excitement for discovery, remain open to new possibilities, and pursue what inspires you.",0,0,0,0,I'm so glad you're curious! Developing curiosity is a great way to foster your enthusiasm and explore different areas. It's also something you can practice to become even better.,0,0
"Stirring up your curiosity can kindle your natural eagerness, willingness to explore different areas and fascination in exploring them.","You have so much potential to explore and learn new things - your curiosity can help kindle your eagerness, willingness to explore different fields and fascination for pursuing them. And the best part is - this is something you can practice!",0,0,0,0,I'm glad to hear that you're curious! Exploring different areas can help you to learn new skills and gain a better understanding of the world. Would you like some guidance on how to start your journey of exploration?,1,0
"Sparking your curiosity can enhance your innate fervor, openness to unfamiliar territories and zest for delving into them. It can also be exercised!","By encouraging your curiosity, you can ignite your natural enthusiasm for discovery, willingness to experiment with various topics, and fascination with learning more about them.",0,0,0,0,I totally understand how you feel! It's really beneficial to spark your curiosity and to be open to new experiences. Why don't you give it a try and see how it feels? You can start by exploring something new today.,0,0
"Enhancing your curiosity can kindle your natural excitement, acceptance of various realms and relish for examining them.","I understand how exciting it must be to have your curiosity sparked, and how that can help you explore unfamiliar territories with enthusiasm and energy. You can exercise this curiosity too!",0,0,0,1,"1. Having a healthy level of curiosity can help you explore new and exciting ideas and experiences. 
2. Being curious can help you develop a greater appreciation for the different perspectives and experiences that come your way. 
3. Let's explore some exercises that can help you cultivate that curiosity and expand your horizons.",1,1
"Reviving your curiosity can rouse your inborn zeal, receptiveness to dissimilar domains and delight in studying them, thus, being indispensible for creativity. And it can be practiced!","By cultivating your curiosity, you can ignite your innate enthusiasm, open-mindedness towards different fields and enjoyment of exploring them.",0,0,0,0,"Yes! Developing curiosity can open up your mind to new areas and bring a relaxed feeling of joy while learning. It's an essential part of creativity, and it's something you can practice! What are some ways you could do that?",1,0
"Keeping curious is key for creativity, openness, and eagerness to delve into new fields, and you can also hone it!","Reviving your curiosity can be a powerful way to tap into your natural enthusiasm, openness to different areas of knowledge, and joy of learning, all of which are essential for creativity. Plus, it's something you can work on and develop!",0,0,0,0,"Absolutely! That's great advice. If you want to keep up your curiosity, why not try challenging yourself with a new activity or learning something new? That will help you stay curious and creative.",0,0
"Being curious is paramount for openness, natural interest and intrinsic motivation, as well as imagination, and you can also practice it!","Cultivating curiosity can be a great way to foster creativity, openness, and enthusiasm for exploring new ideas. You can hone this skill to your advantage!",0,0,0,0,That's great! Curiosity can open many doors. It's a great way to explore new ideas and learn something new. Would you like to practice curiosity with me?,0,0
"Stirring up your curiosity can ignite your instrinsic motivation, preparedness to explore diverse areas and interest in investigating them. Good news - it can be practiced.","Cultivating curiosity can be immensely beneficial for developing openness, natural interest, intrinsic motivation, and imagination, and it's something you can work on!",0,0,0,0,That's great news! Practicing curiosity can help you feel more motivated and prepared. It can also help you become more interested in different topics and explore them in more depth - sounds like a great way to get started!,0,0
"Keeping curious is crucial for creativity, since it helps you uncover your innate eagerness for exploration, and you can also improve on it!","It's exciting to know that you can practice stirring up your curiosity, which can help to ignite your intrinsic motivation, preparedness to explore different areas, and interest in researching them.",0,0,0,0,Sure thing! It's a great way to stay creative and inspired. Why don't you try exploring new ideas and see where it takes you? You may be surprised by how much your curiosity can help you grow.,0,0
Here are a few exercises to help you practice being curious. Choose one!,"It is so important to stay curious when it comes to creativity, as doing so allows you to uncover your natural enthusiasm for exploration, and you can develop it even further!",0,0,0,0,"Great! Let's start with this: What would it look like to take a curious approach to this exercise? I'm here to help guide you through this, so don't hesitate to ask me any questions you may have!",1,1
Below are some engaging exercises to help you practice and cultivate curiosity. Select one that resonates with you and give it a go!,I hope you find these exercises helpful as you work on developing your curiosity. Choose whichever one appeals to you the most!,0,0,0,1,Great! It's wonderful that you're willing to explore curiosity. How about we start with one of these engaging exercises? Which one stands out to you? Let's give it a try together!,0,0
Why not try one of these exercises to help you hone your curiosity?,I invite you to explore the exercises below to practice and nurture your curiosity. Select one that speaks to you and give it a try!,0,0,0,0,"Sure, that could be a great idea! Here are some exercises that could help you develop your curiosity:  1. Explore a new topic or idea. 2. Ask questions and listen for answers. 3. Analyze data and draw conclusions. Would you like to try any of these?",1,1
Here are some activities to help you exercise your curiosity - pick one!,Have you considered trying one of these exercises to help foster your curiosity?,0,0,0,0,Great! Start exploring your curiosity by picking a fun activity. What sounds like the most fun to you? Let's give it a try!,0,0
"To get your curiosity in shape, check out these exercises and give one a go!",We understand that exploring your curiosity can be exciting. Here are some activities to help you on your journey - take your pick!,0,0,0,0,"I'm sure you're curious and I'm here to help. How about you take a look at these exercises and give one a try? That way, you can get your curiosity in shape!",0,0
Here are a few activities to get your curiosity working - why not give one a try?,It may be fun to try out one of these exercises to help get your curiosity in shape!,0,0,0,0,Great idea - why don't you give it a go? Let's explore these activities together and see which one sparks your interest. Shall we begin?,0,0
Exercising your curiosity? Here are some activities to get you started - pick one!,"I understand that you may be feeling hesitant to try something new, but here are some activities that may spark your curiosity - why not give one a go?",0,0,0,0,Great! It's great that you're curious to explore! Here's a few activities for you to get started - why not try one of them out? Let me know how it goes!,0,0
Time to get curious! Give one of these exercises a go.,"If you're feeling curious and want to explore, here are some activities to get you started - why not give one a try?",0,0,0,0,Great idea! Let's start with one of these exercises. What do you think looks like the most fun to you? Let's give it a try!,0,0
It's curiosity time - here are a few activities to help you out. ,Would you like to try one of these exercises and see what happens? It could be an interesting experience!,0,0,0,0,Great! Let's get started. What would you like to do first? I'm here to help guide you through the activities.,0,0
Feeling curious? Here are some exercises for you to try.,I'm so excited to get you started - here are some activities that will spark your curiosity!,0,0,0,0,Great! Let's get started. What exercise would you like to try first? I'm here to provide any guidance you may need.,0,0
Here are some exercises to get your curiosity flowing - pick one and give it a go.,"If you're interested in trying some new exercises, here are some options for you to explore.",0,0,0,0,"Great, let's get started! What exercise would you like to try first? I'm here to guide you through it step by step. Let's explore and have some fun!",0,0
Get curious with these exercises - choose one and get started!,"I understand you may not be feeling motivated to try something new right now, but here are some exercises that could help get your curiosity flowing – why not pick one and give it a go?",0,0,0,0,Great! Let's start exploring. What exercise would you like to begin with? I'm here to help you every step of the way.,0,0
Start exercising your curiosity with these activities - select one!,I encourage you to be curious with these exercises - why not pick one and get going?,0,0,0,0,Great! Let's get started. Why not pick one of these activities and give it a try? I'm here to help if you need anything.,0,0
Give yourself a curiosity workout with these exercises - choose one!,"If you're feeling curious, why not try out one of these activities and see where it takes you?",0,0,0,0,I understand you're looking for a way to give yourself a curiosity workout. Here are some exercises you can choose from. Let's find one that works for you!,0,0
"To get your curiosity muscles working, try one of these exercises.",Explore your curiosity with these exercises - why not give one a try?,0,0,0,0,Great! I'm here to help you. Let's start with an exercise that will get those curiosity muscles going. Shall we?,0,0
"To get your curious side going, check out these exercises and pick one.","To help spark your curiosity, why not give one of these exercises a try?",0,0,0,0,I'm here to help you explore your curiosity! Let's start by trying out one of these exercises. What's your favorite one?,0,0
Get curious with these activities - take your pick and give one a try!,"If you're feeling curious, why not take a look at these exercises and pick one to try?",0,0,0,0,I'm excited for you to explore! Here are some activities that you can choose from. Why don't you pick one and give it a go? Let's see what happens!,0,0
Here are some activities to help you practice being curious - choose the one you want to try.,I'm excited to offer you these activities for you to explore. Why not pick one and give it a go?,0,0,0,0,Great! Let's start exploring! What sounds most interesting to you? Is there an activity that you would like to try first? I'm here to help guide you through the exercises - just let me know!,1,1
Have a look at these exercises to get you in the habit of being curious - pick the one you fancy.,I'm excited to present you with these activities that will help you practice being curious. Please pick out the one you think would be the most interesting to try!,0,0,0,0,Sure thing! Why not take a look at these exercises and pick the one that interests you the most? I'm sure you'll find something that sparks your curiosity.,0,0
 I've got these exercises to help you get curious - pick the one that appeals to you.,I encourage you to take a look at these exercises to help you cultivate curiosity - feel free to choose the one that appeals to you the most.,0,0,0,0,Great! Let's explore your options.  What exercise looks the most interesting to you? I'm here to help guide you - just pick the one that catches your eye!,0,0
I've got a few exercises to help you cultivate curiosity - pick the one you want to do.,I'm here to help you explore your curiosity - please choose an exercise that looks interesting to you.,0,0,0,0,"Great, let's get started! What exercise sounds most interesting to you? Maybe you could try the one that catches your eye first? Let me know and we can discuss it in more detail!",0,0
Here are some exercises to help you practice curiosity - pick the one that speaks to you.,I'm offering a few exercises to help you cultivate curiosity - please choose whichever one appeals to you.,0,0,0,0,"Great, let's explore these exercises together. Which one stands out to you? I'm here to support you along the way.",0,0
 I've got some exercises here that can help you develop curiosity - take your pick.,Here are some exercises to help you practice curiosity - take your time to find the one that resonates with you.,0,0,0,0,Sure! It looks like you have some great activities that can foster curiosity. I'm here to help you through them. What kind of exercise would you like to do first?,0,0
I've got a few activities to help you get curious - select the one you'd like to try.,I'm here to offer you some exercises that can help you cultivate your curiosity - take your time to explore which one resonates with you.,0,0,0,0,Great! Let's take a look at those activities. What looks interesting to you? Would you like me to guide you through one of them?,0,0
Have a look at these exercises to help you become more curious - choose the one you'd like to try.,I have some ideas that I think might help spark your curiosity - why not pick one to experiment with?,0,0,0,0,Sure thing! Here are some exercises to help you become more curious - why not pick one and give it a go? I'm sure you'll find it beneficial!,0,0
I've got some exercises here to get you curious - take your pick.,I encourage you to explore these exercises to help increase your curiosity. Pick the one that appeals to you the most.,0,0,0,0,Great! Let's explore these exercises together. Which one sounds the most interesting to you? We can take it from there.,0,0
Here are some exercises to help you cultivate curiosity - have a look and select the one you want to do.,"I'm sure you're eager to explore - here are some exercises to get you started, take your pick!",0,0,0,0,Great! Let's explore these exercises together. What exercises sound interesting to you? Any in particular that you'd like to try out? I'm here to help you every step of the way.,0,0
Have a look at these exercises to help you flex your curiosity muscle - choose the one you'd like to try.,Here are some exercises to help you cultivate curiosity - take a look and choose the one that interests you the most.,0,0,0,0,Great! You're taking the first step to flexing your curiosity muscle. Here are some exercises that can help. Why don't you pick the one that sounds the most interesting to you? Let's get started!,0,0
Have a look at these exercises to help you get curious - pick the one that interests you.,I encourage you to explore these exercises and pick the one that sparks your curiosity.,0,0,0,0,"Sure thing! Let's take a look. Why don't you start by picking the exercise that you find the most interesting? That way, you'll be more motivated and excited to work on it. Good luck!",0,0
Here are some exercises to help you explore your curiosity - take your pick.,Take some time to explore these exercises. See if any of them spark your curiosity and pick the one that you find most interesting.,0,0,0,0,"Great, let's explore your curiosity! What exercise would you like to try first? Here are some ideas to get you started.",0,0
Have a look at these exercises to practice curiosity - select the one you'd like to try.,I hope these exercises will help you to discover more of your curiosity - please choose whichever ones you would like to try.,0,0,0,1,Great! Let's explore these exercises together. Which one looks the most interesting to you? I'm here to help you through the process if you like.,0,0
I've got a few exercises to get you curious - pick the one you want to do.,Take a look at these exercises to practice curiosity - feel free to choose the one that interests you the most.,0,0,0,0,Great! Let's start exploring! What exercise would you like to try first? I'm here to guide you through the process - feel free to ask me any questions you may have.,1,1
"Congratulations, you are one step closer towards curiosity!",I'm offering a few exercises to help you explore your curiosity - please choose the one you'd like to try.,0,0,0,0,Great job! You have taken an important step on your journey. Let's keep exploring together!,0,0
