sentences,empathetic_rewriting,empathy_score_2ft,empathy_score_2FT,empathy_score_2FT_sentence,empathy_score_triple,empathetic_rewriting_new,NEWempathy_score_triple,NEWempathy_score_2
Take your pick from these humour exercises - why not try one? ,We offer some routines here that can help broaden your sense of humour.,0,0,0,0,Great idea! Here are some interesting humour exercises to choose from. What type of humour are you most interested in trying? I can help you find the perfect exercise for you.,0,0
Have a go at one of these fun humour exercises! ,"I understand you may be feeling overwhelmed, so why not pick one of these humour exercises and give it a go?",0,0,0,0,Sure! Let's try it together. What would you like to do first? Is there a specific exercise that you're interested in trying out?,0,0
Why not give one of these humour exercises a go? ,Why don't you try one of these fun humour exercises? It could be a fun way to pass the time!,0,0,0,0,Great idea! Which one would you like to try? I'm here to guide you through the process if you need help.,0,0
Why not give one of these humour exercises a go? ,"If you're feeling up to it, why not try one of these humour exercises?",0,0,0,0,Sure thing! Here's an exercise to get you started: make a list of things that make you laugh. What comes to mind? It'll be fun!,0,0
Pick from these humour exercises and have a go! ,I encourage you to try one of these humour exercises; it could be a fun and rewarding experience!,0,0,0,0,Let's have some fun! Why don't you choose one of these humour exercises and give it a try? I'm sure you'll enjoy it!,0,0
Select one of these humour exercises and give it a try! ,I encourage you to try out one of these humour exercises and have some fun!,0,0,0,0,Sure thing! Which one would you like to go with? I can help you walk through the exercise if you need any assistance.,0,0
Try out one of these humour exercises! ,I encourage you to select one of these humour exercises and give it a go!,0,0,0,0,"Sure thing! Why don't you start by writing down the funniest thing you can think of. You can also try to think of something funny that happened in your life recently. Finally, you could look up some funny jokes online.",0,0
Choose one of these humour exercises and get started! ,I encourage you to give one of these humour exercises a try!,0,0,0,0,Sure thing! Which exercise would you like to try first? I can help you with whichever one you choose. Let's start having some fun!,0,0
Pick one of these humour exercises and give it a go! ,I'm here to help if you need any assistance selecting one of these humour exercises to get started with!,0,0,0,0,"Great idea! Let's start with the first exercise. What do you think would be funny about the situation? Or, if you'd like, we can try another exercise. Just tell me which one you'd like to try.",0,0
Attempt one of these humour exercises! ,I encourage you to choose one of these humour exercises and give it a try!,0,0,0,0,Sure! Here's one to get you started: think of three funny puns. Ready? Let's give it a go!,0,0
Select a humour exercise and have a go at it! ,Why don't you give one of these humour exercises a try?,0,0,0,0,Sure! Let's start with a humour exercise. What type of exercise would you like to try? Maybe a joke-writing exercise? Or a comedy sketch?,0,0
Go for it and try one of these humour exercises! ,Why not try out a humour exercise and see how it goes?,0,0,0,0,Sure thing! Why don't you start by writing down 10 funny jokes? You can also try to come up with one-liners or short stories to make people laugh. Have fun!,0,0
Check out these humour exercises and pick one! ,I'm here to support you! Why don't you give one of these humour exercises a try?,0,0,0,0,Sure thing! Let's take a look at these exercises together. Which one stands out to you? I'm here to help if you'd like some guidance.,0,0
Have a go at one of the humour exercises! ,I'm so excited that you've decided to check out these humour exercises! What exercise would you like to try?,0,0,0,1,Sure thing! Why don't you give it a shot? You can take your time and practice until you feel confident. Let me know if there's anything else I can help with.,0,0
Try one of these humour exercises now! ,I encourage you to try one of the humour exercises!,0,0,0,0,Sure thing! Let's get started. Here's an exercise that will help you practice your humour: pick a situation and try to think of a funny way to respond to it. Ready to give it a try?,0,0
Take your pick of these humour exercises! ,I encourage you to give one of these humour exercises a try now!,0,0,0,0,I'm happy to help! Let's look at the exercises together and see which one might be a good fit for you. What do you think would be the most fun and enjoyable challenge?,0,0
Test your humour and select an exercise!,Which of these humour exercises would you like to try?,0,0,0,0,Do you want to challenge yourself and see how funny you can be? Here are some exercises to help you find out! Why don't you pick one and give it a try?,0,0
Practicing humour will help you enhance your creativity. Congratulations!,See if you can find an exercise that makes you laugh!,0,0,0,0,I'm so glad that you're taking steps to enhance your creativity. Practicing humour is a great way to do so. What kind of humour do you think would work best for you?,1,1
Utilizing humour can help you increase your creativity - way to go!,Practicing humour can help you unlock your creative potential.,0,0,0,0,That's great! Humour can be a great way to help boost your creativity. Why not try writing down some of your funniest ideas and see what creative results you can get? Have fun!,0,0
Humour can be a great tool for boosting your creativity - well done!,I'm so glad to hear that you're utilizing humour to help increase your creativity - great job!,0,0,0,0,I'm so glad you've been able to use humour as a tool to help boost your creativity! Humour can often be a great way to help get your creative juices flowing. What other techniques do you find helpful in spurring creativity?,1,1
Humour is the key to improving your creative skills - bravo!,I'm so glad to see that you're using humour as a way to enhance your creativity - great job!,0,0,0,0,"That's wonderful! Humour can help open your mind to new ideas and perspectives, and can help you think creatively. Let's try a few exercises to help get your creative juices flowing!",0,0
Humour can do wonders for your creative abilities - great job!,I'm so proud of you for recognizing that humour is an important factor in honing your creative skills!,0,0,0,0,Thank you for acknowledging your creative abilities! I'm sure humour has been a great help. Here's a fun exercise to keep your creative juices flowing: why don't you try writing a short piece of fiction with a humorous twist?,0,0
Utilizing humour will aid in developing your creative skills - congrats!,I'm so impressed by how humour has enhanced your creativity - great job!,0,0,0,0,That's great! Humor is a great tool to help boost your creativity. Here are a few exercises you can try to further develop your creative skills. Let me know how it goes!,0,0
Humour is the secret to unlocking your creative potential - fantastic!,I'm so glad to hear that you're working on developing your creative skills - using humour is a great way to do so! Congratulations!,0,0,0,0,Absolutely! Humour is a fantastic way to unlock your creativity. Why not give it a try and see what ideas you can come up with? I'm sure you'll be surprised by the results!,0,0
Humour is the perfect way to enhance creativity - good job!,I'm so pleased that you've found humour to be the key to unlocking your creative potential!,0,0,0,0,Great work! Humour is an excellent tool to help boost creativity. Why not take a few minutes to explore different ways to use humour in your work? I'm here to help if you need!,0,0
Practicing humour can help you sharpen your creative skills - congrats!,I'm so glad you used humour to enhance your creativity - that was a great decision!,0,0,0,0,That's great! Humour can be an excellent way to stimulate creativity. Why not try writing a few jokes or puns and see what happens? You might surprise yourself!,0,0
Making use of humour can help you elevate your creativity - yay!,I'm so proud of you for using humour to sharpen your creative skills!,0,0,0,0,Great! Humour can help to make your creative process more enjoyable. Why not try using humour in your next project? It could be a fun way to get inspired!,0,0
Using humour can help you strengthen your creativity - awesome!,Using humor can be a great way to boost your creativity - how exciting!,0,0,0,0,That's great! Humour can be a great way to boost your creativity. Why don't you try writing a few jokes or telling some humorous stories and see how it affects your creative process?,0,0
Taking advantage of humour can help you nurture your creativity - yippee!,I'm glad humour can help you strengthen your creativity - that's amazing!,0,0,0,0,Sure thing! Humour can be a great way to nurture your creativity - why not give it a try? Here are some exercises that could help you get started.,0,0
Making humour a part of your life can help you with your creativity - congrats!,I'm so excited that using humour can help nurture your creativity!,0,0,0,0,That's great! Humour can be a great way to boost creativity. Why not take a few minutes to think of ways that you can incorporate more humour in your daily life? Have fun with it!,0,0
Making humour your friend can help you with your creative powers - good work!,I'm so glad that incorporating humour into your life has been beneficial for your creativity - congratulations!,0,0,0,0,I'm glad that humour is helping you with your creative powers! It's great that you're taking the time to practice using humour in a constructive way. Keep up the good work!,0,0
Incorporating humour into your life can help you with your creative abilities - great!,I'm so glad you're using humour to boost your creativity - great job!,0,0,0,0,That's wonderful! Humour can be a great way to get creative - why don't you try it? I'm here to help if you need any tips or guidance.,0,0
Well done! Being more humorous will assist you in being creative!,It's wonderful that incorporating humour into your life can help you with your creative abilities!,0,0,0,0,Great job! Humor can help you come up with ideas in a more creative way. Let's try some exercises that can give you practice in being funny!,0,0
Impressive! Becoming wittier will give you a boost in creativity!,I'm so impressed that you're putting effort into being more humorous! Doing so will help you tap into your creativity.,0,0,0,0,That's great! You can hone your wit with some creative writing exercises. Let's get started!,0,0
Marvelous! Becoming more humorous will help to promote your creativity!,That's great! Strengthening your wit can help you to unleash your creativity!,0,0,0,0,That's great! Humor can help to spark new ideas and open up new possibilities. Why don't you try out some exercises to help promote your creativity and humor?,0,0
Way to go! Becoming more humorous will aid in developing your creativity!,I'm so glad to see you're developing your humorous side! Becoming more humorous can really help foster your creativity.,0,0,0,0,Great job! Humor helps to open up our minds and get us thinking creatively. Let's use this as an opportunity to practice and grow our creativity. What do you think?,0,0
Bravissimo! Becoming more humorous will help you foster creativity!,I'm so proud of you for taking the initiative to work on becoming more humorous - it will help to cultivate your creativity!,0,0,0,1,"Great job! Becoming more humorous can help you express your creativity in a fun and engaging way. Plus, it's a great way to practice and improve your creative skills.",0,0
Superb! Becoming more humorous will help you cultivate creativity!,I'm so impressed! Becoming more humorous can help you unlock your creativity!,0,0,0,0,That's great! Becoming more humorous can help stimulate creativity and boost your confidence too. Why not try writing a few jokes or watching some comedy shows for inspiration?,0,0
Kudos! Becoming more humorous will help you foster creativity!,I'm so glad you're working on becoming more humorous! It's a great way to help cultivate your creativity!,0,0,0,0,"That's great! Humor can help you unlock new ideas and perspectives. Why don't you try writing down some jokes or humorous stories, and see where your creative mind takes you?",0,0
Nice work! Becoming more humorous will help you become more imaginative!,I'm so glad you're working on becoming more humorous! It's a great way to foster creativity and I'm sure it will be beneficial for you.,0,0,0,0,Great job! Becoming more humorous can open the door to new and imaginative ideas. Why not try some exercises to help you become more humorous?,0,0
Well done! Becoming more humorous will aid you in being creative!,I'm so impressed by your work! Becoming funnier can help to foster your creativity!,0,0,0,0,Great job! Developing your sense of humor can help you tap into your creative side. Why not try out some exercises to get those creative juices flowing?,0,0
Great job! Becoming more humorous will help you become creative!,I'm so impressed that you are developing your sense of humor! It can really help to unlock your creativity.,0,0,0,0,I'm so glad to hear that! Humor can be a great way to open up your creative side. Let's try some exercises together to help you tap into your funny side!,0,0
Bravo! Becoming more humorous will help you cultivate creativity!,I think it's wonderful that you put in the effort to become more humorous - it's a great way to help yourself become more creative!,0,0,0,0,Great job! Becoming more humorous can be a great way to unlock your creativity. Why not give it a try? Let's get started!,0,0
Top notch! Becoming more humorous will aid your creativity!,I'm so proud of you for trying to become more humorous - it's a great way to cultivate creativity!,0,0,0,0,Great job! Humor can definitely help to spark creativity. Here are some exercises that might help you get started:  1. Think of a funny situation. 2. Create a funny story. 3. Look for humor in everyday life.,0,0
Outstanding! Becoming more humorous will help you generate creativity!,I'm so glad you're looking to become more humorous! It can be a great way to boost your creativity!,0,0,0,0,That's great! Humor can be a great source of inspiration. Why don't you try brainstorming some humorous ideas? You'll be surprised at how creative you can be!,0,0
Splendid! Becoming more playful will help you cultivate creativity!,That's wonderful! Becoming more humorous can help you open up your creativity!,0,0,0,0,Great! Exercises that involve play can help you express your creativity. Why not try out a few activities and see what works for you?,0,0
Congrats! Becoming more humorous will help you become creative!,I'm so excited for you that becoming more playful will help you cultivate creativity!,0,0,0,0,Great job! Humor can help you develop your creativity - try some fun exercises to get started! What would you like to try first?,0,0
Good job. Would you like to try another exercise in the Humour category?,I'm so glad you're becoming more humorous - it will open up so many creative opportunities for you!,0,0,0,0,Great work! Would you like to take on another exercise in the Humour section? I'm here to help you get the most out of your practice. Let's have some fun!,0,0
Nicely done! Fancy having a go at another exercise in the Humour section?,You did a terrific job! Would you be interested in attempting another exercise in the Humour category?,0,0,0,0,Great job! Would you like to try another exercise in the Humour section? I'm here to guide you through it. What do you say?,0,0
You did well! Care to have a go at another Humour exercise?,You did a great job! Would you like to try another exercise from the Humour section?,0,0,0,0,You did an amazing job! Why don't you try another Humour exercise to test your skills? It would be lots of fun!,0,0
Way to go! Want to tackle another exercise from the Humour category?,I'm really proud of how well you did! Would you like to try another Humour exercise?,0,0,0,0,Great work! Would you like to try another exercise from the Humour section? I'm here to help you every step of the way!,0,0
Bravo! Interested in attempting another Humour exercise?,I'm so proud of you! Would you like to work on another exercise from the Humour section?,0,0,0,0,"Great job! Would you like to try another Humour exercise? I'm here to guide you through it, just let me know if you need any help.",0,0
Well done! Up for trying another exercise in the Humour section?,I'm so glad you enjoyed the Humour exercise! Would you like to try another one?,0,0,0,0,That's great! Would you like to try another fun exercise in the Humour section? I'm here to help you along the way. What do you think?,0,0
Great job! Feel like tackling another Humour exercise?,I'm so impressed with how you did! Would you like to try another exercise in the Humour section?,0,0,0,0,That's awesome! Would you like to try another Humour exercise? I'm here to help you along the way. Let's get started!,0,0
You did splendidly! Fancy attempting another exercise in the Humour section?,I'm so glad you did such a great job! Would you like to try another Humour exercise?,0,0,0,0,Great job! Would you like to try another exercise in the Humour section? I'm sure it will be fun!,0,0
You did a great job! Inclined to try another exercise in the Humour category?,I'm so impressed with how well you did! Would you like to try another exercise in the Humour section?,0,0,0,0,I'm so glad you enjoyed that exercise! Would you like to try something else from the Humour category? I'm here to help you find something that suits you!,0,0
Superb effort! Wanna take on another exercise from the Humour section?,I'm so impressed with your hard work! Would you like to give another exercise in the Humour category a shot?,0,0,0,0,Great job! Would you be interested in trying a different exercise from the Humour section? I'm sure you'll find it both fun and challenging!,0,0
Marvelous job! Want to take on another Humour exercise?,That was an amazing effort! Would you like to try another exercise from the Humour section?,0,0,0,0,Great job! Would you like to try another fun exercise? Let me know if you need any help.,0,0
Good going! Care to have a go at another exercise in the Humour category?,I'm so proud of the work you did on this humour exercise. Would you like to try another one?,0,0,0,0,"Great job! Would you like to try another exercise in the Humour section? I'm here to help you out, so let me know if you need any assistance.",0,0
Very impressive! Interested in trying another exercise in the Humour section?,I'm impressed! Would you like to try another exercise in the Humour section?,0,0,0,0,That's great! Would you like to take a look at the other exercises in the Humour section? I'm here to help you with any questions you have.,0,0
Kudos! Up for attempting another exercise in the Humour category?,That's really amazing! Would you like to give another exercise in the Humour section a go?,0,0,0,0,That's great! Ready to challenge yourself with another exercise in the Humour category? Let's do it!,0,0
Terrific work! Think you can handle another exercise from the Humour section?,I'm glad to see that you're giving the Humour category another try - good for you!,0,0,0,0,Great job! Are you feeling ready to take on one more exercise from the Humour section? I'm sure you'll do great!,0,0
Care to take a stab at a Humour exercise?,I'm so impressed with the work you have done! Would you like to give another exercise from the Humour section a try?,0,0,0,0,"Sure, that sounds like fun! Let's try it. What would you like me to do?",0,0
Want to give another Humour workout a whirl?,Would you be willing to give a Humour exercise a try?,0,0,0,0,Great idea! Let's have some fun with this. I can guide you through some exercises to help you practice your humour. Shall we get started?,0,0
Do you fancy tackling another Humour exercise?,Would you like to try another Humour workout?,0,0,0,0,Sure! Would you like me to guide you through it? I'm happy to help.,0,0
Feeling up to another Humour exercise?,Would you like to try another Humour exercise?,0,0,0,0,Absolutely! Would you like me to guide you through one? Or would you prefer to take it on your own?,0,0
Mind attempting another Humour exercise?,Would you like to do another Humour exercise?,0,0,0,0,"Sure, I'd love to help you with another humour exercise. What would you like to try?",0,0
Keen to have a go at another Humour exercise?,Would you like to try another Humour exercise?,0,0,0,0,Sure thing! Would you like to try a wordplay exercise or a pun exercise? I'm here to help you out however I can.,0,0
Inclined to give another Humour exercise a go?,Are you interested in trying another Humor exercise?,0,0,0,0,"Sure, why not? Let's give it a try. What type of Humour exercise would you like to do?",0,0
Are you up for another Humour exercise?,Would you like to try another Humour exercise?,0,0,0,0,Sure! Would you like to try a new one? I can provide some options for you to choose from. What would you like to do?,0,0
In the mood for another Humour exercise?,Would you like to do another Humour exercise?,0,0,0,0,Sure thing! Let's get started. What kind of humour exercise would you like to do?,0,0
Thinking of doing another Humour exercise?,Would you like to try another Humour exercise?,0,0,0,0,Sure! That sounds like a great idea. How about we try it now? Shall I lead you through the process step by step?,0,0
Why not have a go at another Humour exercise?,Are you considering doing another Humour exercise?,0,0,0,0,Sure! Why don't you try a Humour exercise? It'll be fun and you'll learn something too. Let's do it together!,0,0
Fancy attempting another Humour exercise?,Would you like to give another Humour exercise a try?,0,0,0,0,Sure! Let's give it a go. What type of exercise would you like to do?,0,0
