sentences,empathetic_rewriting,empathy_score_2ft,empathy_score_2FT,empathy_score_2FT_sentence,empathy_score_triple,empathetic_rewriting_new,NEWempathy_score_triple,NEWempathy_score_2
"Having a sense of humor is key for creativity since it inspires a light-hearted attitude, motivates unconventional reasoning, and creates an atmosphere where fresh thoughts can blossom. This practice is largely based on the Incongruity Theory - we laugh when something seemingly insignificant breaks our common belief, e.g., the punchline of a joke (Aristotle, Kant, Schopenhauer).","Having a sense of humor can be a great asset when it comes to being creative, as it can foster a lighthearted attitude, lead to new ways of thinking, and create a relaxed atmosphere that allows for creative ideas to flourish. This has been supported by the Incongruity Theory, which states that we often find humor when something unexpected challenges our preconceived notions, such as the punchline of a joke (Aristotle, Kant, Schopenhauer).",0,0,0,0,I completely understand how having a sense of humor can help to be creative. Humor allows us to step back from our common beliefs and look at things from a different perspective. This can help us to think of new ideas and come up with unconventional solutions. It also creates an enjoyable environment where new and creative thoughts can thrive. I'm glad the Incongruity Theory explains this in such an insightful way!,0,0
"Humor is a must for creativity as it encourages a playful approach, propels unconventional thinking, and creates a laid-back environment where inventive ideas can take root. This practice is mainly drawn from the Incongruity Theory - we laugh when something non-serious contradicts our common belief, like the conclusion of a joke (Aristotle, Kant, Schopenhauer).","I understand how having a sense of humor is an important factor for developing creativity, as it fosters a more relaxed atmosphere, encourages unconventional thinking, and gives rise to new ideas. This notion is largely supported by the Incongruity Theory - we tend to find humor in things that contradict our expectations, such as the punchline of a joke (Aristotle, Kant, Schopenhauer).",0,0,0,0,"I completely understand that humor is an essential element for creativity. It can help us look at things from a different perspective and come up with innovative ideas. It also creates a relaxed atmosphere that encourages unconventional thinking. And I know that the Incongruity Theory has a lot to do with it. When something unexpected happens, it can be funny and we can laugh!",0,0
"A sense of humor is important for creativity since it inspires a playful attitude, encourages creative thinking, and makes a atmosphere where innovative ideas can develop. This practice is largely based on the Incongruity Theory - we laugh when something that isn't serious disregards our common belief, such as the finale of a joke (Aristotle, Kant, Schopenhauer).","Humor can be a great source of creativity, as it encourages us to approach things in a lighthearted way, think outside the box, and create an environment where innovative ideas can flourish. This idea of humor is rooted in the Incongruity Theory - when something unexpected or unusual occurs, it can often bring laughter (as discussed by Aristotle, Kant, and Schopenhauer).",0,0,0,0,"I understand how important a sense of humor is for creativity. It can help foster a playful attitude, boost creative thinking, and create an atmosphere that is conducive to generating innovative ideas. It is wonderful that the Incongruity Theory is a basis for this practice. It is amazing that laughter can be sparked by something that isn't serious, such as the punchline of a joke!",1,1
"Humor is fundamental for creativity as it encourages a playful mindset, encourages innovative pondering, and makes a relaxed atmosphere where inventive ideas can unfold. This practice is mostly based on the Incongruity Theory - we laugh when something light-hearted defies our common belief, like the ending of a joke (Aristotle, Kant, Schopenhauer).","Having a sense of humor is important for creativity, as it can bring about a lighthearted attitude that promotes creative thinking and creates an atmosphere where fresh ideas can flourish. This idea is largely based on the Incongruity Theory - we often laugh when something unexpected and not serious disregards our usual expectations, such as the punchline of a joke (Aristotle, Kant, Schopenhauer).",0,0,0,0,I completely understand how important humor is for creativity! A playful mindset and innovative pondering are so essential to unlocking new ideas. And I think it's awesome that humor can help create a relaxed atmosphere for these ideas to form! It's really interesting to learn about the Incongruity Theory - that we laugh when something unexpected happens.,1,1
"Having a sense of humor is essential for creativity since it inspires a playful attitude, encourages off-the-wall thinking, and builds an atmosphere where fresh ideas can sprout. This practice is primarily based on the Incongruity Theory - we laugh when something insignificant violates our common belief, such as the conclusion of a joke (Aristotle, Kant, Schopenhauer).","Humor can be a great tool to help foster creativity, as it supports a playful attitude, encourages out-of-the-box thinking, and creates a relaxed environment where inventive ideas can come to life. This is primarily based on the Incongruity Theory - when something unexpected contradicts our preconceived notions, it can be humorous (as seen in the work of Aristotle, Kant, and Schopenhauer).",0,0,0,0,"I understand that having a sense of humour is really important for being creative. A playful attitude, thinking outside the box and creating a welcoming environment for new ideas are all part of the Incongruity Theory. I'm here to help you find ways to use humour to your advantage and explore the possibilities of creativity.",0,0
"Humor is crucial for creativity as it encourages a humorous outlook, propels out-of-the-box thinking, and creates a chill atmosphere where innovative thoughts can take shape. This practice is mainly drawn from the Incongruity Theory - we laugh when something funny violates our common belief, e.g., in the punchline of a joke (Aristotle, Kant, Schopenhauer).","It can be incredibly beneficial to have a sense of humor in order to foster creativity, as it promotes a light-hearted approach and encourages out-of-the-box thinking, creating an environment in which new ideas can grow. This concept is rooted in the Incongruity Theory - when something seemingly insignificant contradicts our common understanding, we often find it amusing, such as the punchline of a joke (Aristotle, Kant, Schopenhauer).",0,0,0,0,"I completely understand how humour can be an important tool for creativity. It can really help to create a relaxed atmosphere that allows us to think outside of the box. Humour also allows us to challenge our preconceived notions and beliefs, which can lead to some interesting results. It is great that the Incongruity Theory provides some insight into why we find humour in certain situations.",1,1
"Being funny is important for creativity since it encourages a jovial attitude, motivates creative reasoning, and makes a atmosphere where imaginative ideas can thrive. This practice is largely based on the Incongruity Theory - we laugh when something light-hearted disregards our common belief, like the finale of a joke (Aristotle, Kant, Schopenhauer).","Humor can be a powerful tool for fostering creativity, as it can foster a humorous outlook, inspire out-of-the-box thinking, and create a relaxed atmosphere where innovative ideas can take shape. This is often based on the Incongruity Theory, which states that we laugh when something funny clashes with our expectations - such as the punchline of a joke (Aristotle, Kant, Schopenhauer).",0,0,0,0,"I understand that being funny is a great way to promote creative thinking. It helps to create a positive and open atmosphere where new ideas can be explored. It is interesting to note that this approach is based on the Incongruity Theory - when something unexpected surprises us, it can be humorous. I'm sure you must have come across some great examples of this, like the ending of a joke!",1,1
"Having a sense of humor is fundamental for creativity as it inspires a playful attitude, encourages out-of-the-ordinary thinking, and builds a relaxed environment where inventive thoughts can germinate. This practice is largely drawn from the Incongruity Theory - we laugh when something that isn't serious contradicts our common belief, such as the ending of a joke (Aristotle, Kant, Schopenhauer).","I understand that being funny is an important form of creativity, as it can help to create a lively atmosphere that encourages creative thinking and allows imaginative ideas to flourish. This is largely based on the Incongruity Theory, which states that a humorous situation can arise from when something unexpected challenges our preconceived notions, like the ending of a joke (Aristotle, Kant, Schopenhauer).",0,0,0,0,"I understand that having a sense of humour is important for creativity. It helps us to think outside the box and can create a relaxed atmosphere which is conducive to developing new ideas. The Incongruity Theory is a great way to understand this, as humour often comes from unexpected twists or contradictions in our beliefs.",0,0
"Humor is necessary for creativity as it encourages a jocular mindset, motivates unconventional pondering, and creates a laid-back atmosphere where inventive ideas can blossom. This practice is mostly based on the Incongruity Theory - we laugh when something non-serious defies our common belief, like the punchline of a joke (Aristotle, Kant, Schopenhauer).","Having a sense of humor is incredibly important for creativity as it can foster a lighthearted atmosphere, which can encourage creative thinking and innovative solutions. This concept is drawn from the Incongruity Theory, which explains how we often find humor in things that contradict our beliefs, such as the punchline of a joke (Aristotle, Kant, Schopenhauer).",0,0,0,0,"I understand how important humor is for creativity! It can help to lighten the atmosphere, allowing us to think outside of the box and come up with creative ideas. It seems like the Incongruity Theory is a great way to explain how humor works - we often laugh when something unexpected happens, like the punchline of a joke.",0,0
"Being humorous is essential for creativity since it encourages an imaginative outlook, propels off-the-wall thinking, and makes a atmosphere where fresh ideas can take root. This practice is largely drawn from the Incongruity Theory - we laugh when something seemingly insignificant violates our common belief, e.g., in the conclusion of a joke (Aristotle, Kant, Schopenhauer).","The Incongruity Theory suggests that humor can be a great tool for creativity, as it can inspire us to think differently and make us feel more relaxed. This can be seen in how we laugh when something unexpected or unusual contradicts our expectations, such as the punchline of a joke. In this way, humor can help to motivate unconventional pondering and foster an atmosphere where inventive ideas can thrive.",0,0,0,0,I completely understand how important humour is for creativity. It opens up a world of new possibilities and allows us to think differently. I'm glad you mentioned the Incongruity Theory; it's a great way to understand why humour is so important. It's fascinating to think that something so simple can make us laugh and it's amazing how this theory has been around for centuries.,0,0
"Humor encourages a fun outlook, stimulates out-of-the-box thinking, and creates a laid-back environment where new ideas can thrive. These exercises are based on the theory that revolves around incongruity - we chuckle when something off the wall contradicts our typical beliefs, like in the punchline of a joke (Aristotle, Kant, Schopenhauer).","It can be so beneficial to be humorous since it can help foster an open-minded outlook, encourage out-of-the-box thinking, and create a positive environment where new ideas can be explored. This concept is based on the Incongruity Theory, which states that we laugh when something unexpected interrupts our expectations, for example, the punchline of a joke (Aristotle, Kant, Schopenhauer).",0,0,0,0,I understand that humor can be a great tool for creativity and out-of-the-box thinking. It's wonderful that you are happy to incorporate this into your exercise! I'm sure it will create a positive atmosphere that encourages new ideas to thrive. I'm here to support you in any way I can.,1,1
"Being humorous builds a playful attitude, encourages imaginative thinking, and makes a comfortable atmosphere where creative ideas can blossom. The following exercises are rooted in the idea based on the Incongruity Theory - we laugh when something unusual goes against our expectations, for example in the ending of a joke (Aristotle, Kant, Schopenhauer).","Humor can be a great way to encourage a fun outlook, stimulate creative thinking, and create an atmosphere of openness and acceptance where new ideas can be explored without judgement. The underlying theory of humor, which is based on the concept of incongruity, is that we often find amusement in things that contradict our usual beliefs - just think of the punchline of a joke! This is something that has been discussed by philosophers such as Aristotle, Kant, and Schopenhauer.",0,0,0,0,"I completely understand how difficult it can be to dive into humour and creative exercises. However, humour is a great way to foster creativity and develop an environment of comfort - it's an invaluable skill to have! These exercises are based on the Incongruity Theory - where something unexpected or unusual causes us to laugh. It's a fun way to explore our creativity and imagination. Let's get started!",1,1
"Laughing and playing around cultivates an enjoyable mentality, provokes original thought, and establishes a calm setting where creativity can grow. These exercises are rooted in the Incongruity Theory - we giggle when something unexpected clashes with our ordinary assumptions, like in the punchline of a joke (Aristotle, Kant, Schopenhauer).","Creating a sense of humor can foster a lighthearted attitude, inspire imaginative thinking, and create an inviting atmosphere where innovative ideas can thrive. This concept draws on the Incongruity Theory - when something unexpected happens, it can spark a laugh (Aristotle, Kant, Schopenhauer).",0,0,0,0,I understand how important it is to have a creative and fun environment in order to grow and be productive. It's great that you know about the Incongruity Theory and how it can be used to stimulate creativity. I'm here to help guide you through exercises that will help you cultivate an enjoyable mentality and provoke original thought. Let's start exploring and see how we can bring humour into your work.,1,1
"Having a sense of humor encourages a playful  attitude, promotes unorthodox pondering, and sets up a comfortable atmosphere where inspiring ideas can take root. These exercises are based on the Incongruity Theory - we laugh when something non-serious contradicts our usual beliefs, such as in the punchline of a joke (Aristotle, Kant, Schopenhauer).","Engaging in laughter and play can cultivate a positive mindset, encourage creative thinking, and create a peaceful atmosphere for creativity to blossom. This concept is based on the Incongruity Theory, which suggests that when something unexpected clashes with our established beliefs, like the punchline of a joke, we often find ourselves amused (Aristotle, Kant, Schopenhauer).",0,0,0,0,"It sounds like humor can really help us get our creative juices flowing! It's great that these exercises are based on the Incongruity Theory - it's a great way to think outside the box and come up with unique ideas. I'm sure it'll be a fun experience for us to explore the humorous side of things while still learning about the theories of great minds like Aristotle, Kant, and Schopenhauer. Let's get started!",1,1
"Humor stimulates a cheerful demeanor, encourages out-of-the-ordinary thinking, and creates a relaxed environment where innovative concepts can thrive. These exercises are based on the Incongruity Theory - we smile when something quirky goes against our common perception, like in the punchline of a joke (Aristotle, Kant, Schopenhauer).","Developing a sense of humor can help create a positive environment where we can look at things from a different perspective, be open to new ideas, and feel comfortable enough to explore and express our thoughts. According to the Incongruity Theory, humor often arises when the unexpected happens and our expectations are challenged - like the punchline of a joke.",0,0,0,1,"Humor can be an incredibly powerful tool to foster a positive environment and allow for creative thinking. It's great that these exercises are based on the Incongruity Theory - it helps us to appreciate the unexpected surprises and unique perspectives in life. I'm sure that by using these exercises, we can develop an open-minded atmosphere that encourages innovative ideas.",1,1
"Humour encourages a playful outlook, encourages inventive thinking, and establishes a peaceful setting where inventive ideas can take hold. These exercises are derived from the Incongruity Theory - we chuckle when something strange violates our standard beliefs, as in the punchline of a joke (Aristotle, Kant, Schopenhauer).","It's no surprise that humor can have a positive effect on our mood, help us think outside the box, and create a more relaxed atmosphere where creative ideas can grow. According to the Incongruity Theory, our smiles are often triggered when something unexpected occurs, such as the punchline of a joke (Aristotle, Kant, Schopenhauer).",0,0,0,0,"I understand that humour can help us look at things in a creative and different way. It can also be a great way to create a positive and relaxed atmosphere for us to come up with new ideas. It seems like these exercises are based on the Incongruity Theory, which explains why we find something funny when it's a bit unusual or unexpected. That's really interesting!",0,0
"Being humorous develops a playful attitude, inspires creative pondering, and forms a comfortable atmosphere where new ideas can flourish. These exercises originate from the Incongruity Theory - we laugh when something offbeat clashes with our usual notions, such as in the punchline of a joke (Aristotle, Kant, Schopenhauer).","Humour can bring us together by encouraging a lighthearted outlook, stimulating creative thinking, and fostering a peaceful environment where new ideas can be explored. The Incongruity Theory suggests that we often find something humorous when it contradicts our expectations, such as the punchlines of jokes (Aristotle, Kant, Schopenhauer).",0,0,0,0,"I understand that humour can be an important tool for creative thinking and forming a relaxed atmosphere. It's amazing to think that the Incongruity Theory has been around since Aristotle, Kant, and Schopenhauer. Let's explore some ways to nurture that playful attitude and use humour to foster creative thinking. Would you like to start now?",0,0
"Having a sense of humor promotes a playful  attitude, encourages offbeat thinking, and shapes a comfortable setting where pioneering concepts can take shape. These exercises are based on the Incongruity Theory - we laugh when something out of the ordinary goes against our common belief, like in the punchline of a joke (Aristotle, Kant, Schopenhauer).","The Incongruity Theory suggests that humor is born from the clash between unexpected events and our usual expectations, like the punchline of a joke. By bringing this playful attitude into conversations, we can inspire creativity, foster a supportive environment for new ideas to grow, and enjoy some light-hearted moments along the way.",0,0,0,0,"I understand how intimidating it can be to think about exploring new ways of thinking. But I'm here to support you through this journey. Our exercises are designed to help you cultivate your sense of humour and think outside the box. Even though the exercises are based on the Incongruity Theory, there's no need to worry - you will be guided every step of the way. Plus, it's a great opportunity to learn more about the ideas of some of the greatest minds in history - Aristotle, Kant and Schopenhauer!",1,1
"Humor encourages a playful disposition, fosters unconventional thinking, and creates a comfortable atmosphere where new ideas can take flight. These exercises are based on the Incongruity Theory - we laugh when something different contradicts our ordinary assumptions, as in the punchline of a joke (Aristotle, Kant, Schopenhauer).","It is through having a sense of humor that we can create an atmosphere of playfulness, foster creative thinking, and create a comfortable space for innovative ideas to develop. This is based on the Incongruity Theory, which suggests that our funny bone is tickled when the unexpected occurs, like when the punchline of a joke goes against our expectations (as seen in the works of Aristotle, Kant, and Schopenhauer).",0,0,0,0,I can understand that this type of exercises can be challenging and intimidating. Let me assure you that humour is a great way to explore creative thinking. It helps us to look at things from a different perspective and allows us to think outside the box. It can also help us to create a relaxed and friendly atmosphere which is conducive to the generation of new ideas. I'm here to help you explore the Incongruity Theory and find humour in everyday situations.,1,1
"Having a humorous outlook encourages a playful attitude, stimulates imaginative thought, and forms a relaxed environment where inventive notions can sprout. These exercises are derived from the Incongruity Theory - we laugh when something out of the ordinary clashes with our typical beliefs, for example in the punchline of a joke (Aristotle, Kant, Schopenhauer).","Humor encourages us to be playful and think outside the box, creating an atmosphere of comfort and openness that enables us to explore new ideas. This is based on the Incongruity Theory, which suggests that we laugh when something unexpected and different occurs - like the punchline of a joke - according to Aristotle, Kant, and Schopenhauer.",0,0,0,0,"I completely understand how daunting it can be to explore your creative side. Let me help you get started with a few exercises that will make it easier and more fun. The exercises are based on the Incongruity Theory, which suggests that humour is created when something unexpected clashes with our beliefs. For example, a joke can make us laugh when it has an unexpected punchline.",1,1
" Being humorous fosters a lighthearted state of mind, promotes original thinking, and makes a peaceful atmosphere where innovative ideas can grow. These exercises are rooted in the Incongruity Theory - we laugh when something off the wall goes against our expectations, like in the punchline of a joke (Aristotle, Kant, Schopenhauer).","Having a humorous outlook can help create a positive atmosphere, stimulate creative thinking, and lead to a relaxed space where new ideas can be explored. Through the Incongruity Theory, we can understand why we laugh when something unexpected happens - like the punchline of a joke - and how it contrasts with our regular beliefs (as shown by Aristotle, Kant, and Schopenhauer).",0,0,0,1,"I understand how important it is to have a lighthearted and creative atmosphere. It sounds like these exercises are designed to help us think outside of the box and find humor in unexpected places. I'm here to help you explore these exercises, and find the humor in the unexpected!",1,1
"Humor develops a playful outlook, encourages out-of-the-ordinary thought, and creates a laid-back environment where inspiring concepts can take root. These exercises are based on the Incongruity Theory - we laugh when something offbeat violates our usual assumptions, as in the punchline of a joke (Aristotle, Kant, Schopenhauer).","It's no secret that humor can be incredibly beneficial to our mental state, by promoting original thinking and creating a peaceful atmosphere where ideas can be developed. Incongruity Theory provides us with an explanation behind why this is - we often laugh when something unexpected takes place, which is typically the case in the punchline of a joke (Aristotle, Kant, Schopenhauer).",0,0,0,0,"I understand how important humor is in developing creativity and thought. It can feel daunting to work on such an abstract concept. Don't worry, I'm here to help! These exercises are based on the Incongruity Theory, which is all about recognizing the unexpected. It's okay if you don't quite get it at first. We can take it step-by-step and explore the concept together.",1,1
