sentences,empathetic_rewriting,empathy_score_2ft,empathy_score_2FT,empathy_score_2FT_sentence,empathy_score_triple,empathetic_rewriting_new,NEWempathy_score_triple,NEWempathy_score_2
"Possessing a sense of humor encourages a playful mentality, stimulates creative pondering, and shapes a relaxed setting where ingenious ideas can thrive. These exercises revolve around incongruity - we laugh when something unexpected goes against our common perception, like in the punchline of a joke (Aristotle, Kant, Schopenhauer).","Humor can foster a jovial attitude, stimulate creative thinking, and create a relaxed environment in which original ideas can be explored. According to the Incongruity Theory, we often find ourselves laughing when something unexpected goes against our expectations, such as the punchline of a joke (Aristotle, Kant, Schopenhauer).",0,0,0,0,"I totally understand how important having a sense of humor is! It can really help to create a fun and relaxed atmosphere where new and creative ideas can flourish. It sounds like these exercises focus on being able to recognize when something unexpected goes against our expectations, like the punchline of a joke. It's definitely a great way to expand our creativity and experience life in a different way!",1,1
"Having a humorous outlook builds a playful attitude, encourages imaginative thinking, and establishes a comfortable atmosphere where pioneering notions can bloom. These exercises are derived from the Incongruity Theory - we laugh when something non-serious clashes with our typical beliefs, such as in the punchline of a joke (Aristotle, Kant, Schopenhauer).","Having a sense of humor can create an environment where creative thought and innovation can flourish. It can provide a playful, relaxed atmosphere where unexpected moments can bring a smile and inspire innovative ideas. As Aristotle, Kant, and Schopenhauer noted, humor is often based on perceiving something incongruous and unexpected, like the punchline of a joke.",0,0,0,0,"I understand that humour can be a great way to open the doors to creative and curious thinking. It can help create an environment that encourages people to come up with new ideas. I'm glad you mentioned the Incongruity Theory, which is how we often find humour in the contrast between what we expect and what is actually said or done.",0,0
"Being humorous encourages a playful mindset, fosters creative pondering, and forms a calm setting where new ideas can take hold. These exercises are based on the Incongruity Theory - we laugh when something unusual contradicts our ordinary assumptions, like in the punchline of a joke (Aristotle, Kant, Schopenhauer).","Having a humorous outlook can help foster an atmosphere where it is safe to explore new ideas and express imaginative thinking. By creating a sense of playfulness and comfort, we can open ourselves up to the unexpected, allowing for our incongruous beliefs to be reconciled - like in the punchline of a joke (Aristotle, Kant, Schopenhauer).",0,0,0,0,"I'm so glad to hear that you're interested in developing your creativity, curiosity, and humor! Humor helps us be more creative and it can be a great way to relax and let new ideas flow. These exercises are based on the Incongruity Theory of humor, which states that we laugh when something unexpected contradicts our normal expectations. It's amazing how the ancient philosophers like Aristotle, Kant, and Schopenhauer were on the right track!",1,1
Here you can find some exercises to help you practice humour.,"Laughter is often an unexpected and delightful surprise that can help us foster creativity and creative thinking. By allowing ourselves to experience the joy of a humorous moment, we can create a relaxed atmosphere where new and innovative ideas can take root. This is based on the Incongruity Theory, which states that humor is created when something unexpected contradicts our normal expectations, such as the punchline of a joke (Aristotle, Kant, Schopenhauer).",0,0,0,1,I'm so glad you're interested in exploring humour! Here are some exercises that might help you get started. Why not give them a try and see how you go?,0,0
Discover a collection of exercises below that can assist you in honing your sense of humor.,I hope these exercises can help you practice humour and get more comfortable expressing yourself.,0,0,0,0,I'm so glad you are ready to hone your sense of humor! Here you will find a great collection of exercises that you can use to do just that. I'm rooting for you!,0,0
Here you can do some exercises to hone your humour.,We've compiled a selection of exercises below that can help you develop your sense of humor.,0,0,0,0,"I understand how daunting it can be to hone your humour skills. Don't worry, I'm here to help! Here are some great exercises to get you started. They will help you increase your creativity, curiosity and humour. Good luck!",1,1
Here you can find some drills to sharpen your sense of humour.,I hope that these exercises help you become better at expressing your humour.,0,0,0,0,I'm so glad you want to sharpen your sense of humour! Here are some drills that can help you explore your creative and curious side. Let's have some fun together and see how it can bring a smile to your face!,1,1
Here you can attempt some workouts to develop your sense of humour.,I hope these drills can help you develop a better sense of humour.,0,0,0,0,I'm so glad you're here to explore ways to develop your sense of humour! I'm here to help you along your journey. I'm sure these exercises will be a great help and I'm excited to hear how your progress goes!,1,1
Here you can try out some activities to help you work on your wit.,I hope these workouts help you develop your sense of humour.,0,0,0,0,I'm so glad you're interested in working on your wit! Let me help you out with some activities that could help you on this journey. Here are some exercises that could help you to get started. I'm here to help you out every step of the way.,1,1
Here you can engage in some exercises to cultivate your humour.,Here are some activities that can help you sharpen your wit.,0,0,0,0,"I'm so glad you're here! Let's take some time to explore our humour together. It'll be a fun and creative journey, and I'm sure you'll be able to come away with a few more tools in your toolbox. Let's get started!",1,1
Here you can do some exercises to refine your ability to laugh.,Here you can explore some activities to help you develop your sense of humour.,0,0,0,0,"I understand how difficult it can be to cultivate a sense of humour. Here I'm offering you the opportunity to hone your skills in creativity, curiosity, and humour. Let's take a few moments to work on these exercises together. Let's make sure you can laugh a little more!",1,1
Here you can practice some routines to enhance your ability to laugh.,Here you can practice exercises that can help you feel more comfortable with laughing.,0,0,0,0,I'm so glad you've decided to practice some routines to enhance your ability to laugh. It's a great way to get rid of stress and brighten up your day. Let's get started! What kind of routines would you like to try?,1,1
Here you can perform some tasks to boost your humour.,Here you can try out some exercises to help you cultivate a more joyful sense of humor.,0,0,0,0,I'm so glad you are interested in enhancing your humour! Here are some exercises that will help you achieve this. Let's get started and have some fun! Would you like to get started?,0,0
Here you can practice some drills to increase your humorous side.,I hope these tasks help bring a smile to your face.,0,0,0,0,I'm so glad that you are interested in developing your humorous side! Here are some exercises to help you along your journey. Have fun with it and don't forget to laugh! It can be a great way to explore creativity and curiosity.,1,1
Here you can take on some workouts to add to your funny bone.,You can use these drills to help develop your sense of humor.,0,0,0,0,Great! I'm so glad to hear that you want to add to your funny bone. Let me help you. I'm here to guide you through some fun exercises that will help you become even more creative and humorous. Shall we get started?,1,1
Here you can take part in some activities to strengthen your funny side.,Here you can find some workouts to help you to have some fun!,0,0,0,0,"I'm so glad you're interested in exploring your funny side! Let me help you get started - here are some activities that can help you do just that. Have fun, and don't be afraid to take risks! It's all part of the creative process.",0,0
Here you can practice some exercises to upgrade your humour.,We can offer you some activities here that can help to bring out your inner sense of humor.,0,0,0,0,I'm so glad you're interested in upgrading your humour. Here are some exercises to help you get started. Let me know if you need any guidance along the way. I'm here to help!,1,1
Here you can do some drills to improve your sense of humour.,I hope these exercises will help you to enhance your sense of humour.,0,0,0,0,I'm so glad you're interested in improving your sense of humour! Let me help you out with that. Here are some fun and interesting exercises to help you develop your humour. I'm sure you'll find them helpful and enjoyable!,1,1
Here you can participate in some routines to expand your sense of humour.,I hope these drills help you to strengthen your sense of humour.,0,0,0,0,"I'm so glad you're interested in exploring your sense of humour! Here, I can help you find some exercises that will help you grow and develop your sense of humour. Would you like to give it a try?",1,1
Take your pick from these humour exercises - why not try one? ,We offer some routines here that can help broaden your sense of humour.,0,0,0,0,I'm sure these humour exercises will be great fun! Why don't you give one a go? I'm sure you'll have a great time!,0,0
Have a go at one of these fun humour exercises! ,"I understand you may be feeling overwhelmed, so why not pick one of these humour exercises and give it a go?",0,0,0,0,I'm so excited for you to try one of these fun humour exercises! It's a great way to practice your creativity and curiosity. Good luck!,0,0
Why not give one of these humour exercises a go? ,Why don't you try one of these fun humour exercises? It could be a fun way to pass the time!,0,0,0,0,"I understand it can be daunting to try something new, but why not give it a try? I'm sure you'll find it fun and rewarding. Why not give one of these humour exercises a go? It's a great way to practice your creativity and curiosity!",0,0
Why not give one of these humour exercises a go? ,"If you're feeling up to it, why not try one of these humour exercises?",0,0,0,0,"I understand that you may be a bit hesitant to try an exercise in humour, but why not give it a try? I'm sure it will be a fun and rewarding experience. Plus, it's a great way to explore your creativity. Let's give it a go!",0,0
Pick from these humour exercises and have a go! ,I encourage you to try one of these humour exercises; it could be a fun and rewarding experience!,0,0,0,0,I'm so glad that you want to explore humour exercises! Let me help you pick the best one for you. Is there a specific exercise you want to try? Or would you like me to recommend something?,1,1
Select one of these humour exercises and give it a try! ,I encourage you to try out one of these humour exercises and have some fun!,0,0,0,0,I understand how difficult it can be to choose one exercise. Let me help you: why don't you pick one that you think looks the most fun? You can always come back and try the others later. I'm here to support you in whatever decision you make.,1,1
Try out one of these humour exercises! ,I encourage you to select one of these humour exercises and give it a go!,0,0,0,0,I understand that you are interested in humour exercises. Here are some great ones that you can try out! They will help you to get creative and curious. Let's see how humorous you can be!,0,0
Choose one of these humour exercises and get started! ,I encourage you to give one of these humour exercises a try!,0,0,0,0,Great! Let's get started! Which of these humour exercises would you like to do first? I'm here to help you explore your creative and curious side and have a good time doing it.,0,0
Pick one of these humour exercises and give it a go! ,I'm here to help if you need any assistance selecting one of these humour exercises to get started with!,0,0,0,0,I'm glad you're ready to give it a try! What kind of humour exercise would you like to attempt? I'm here to help you out.,0,0
Attempt one of these humour exercises! ,I encourage you to choose one of these humour exercises and give it a try!,0,0,0,0,I understand it can be challenging to come up with humour. How about trying one of these humour exercises to get your creative juices flowing? I'm here to support you every step of the way. Let's do this together!,1,1
Select a humour exercise and have a go at it! ,Why don't you give one of these humour exercises a try?,0,0,0,0,Sure thing! Why don't you try the humour exercise below? It looks like a lot of fun! Let me know how it goes!,0,0
Go for it and try one of these humour exercises! ,Why not try out a humour exercise and see how it goes?,0,0,0,0,I'm so glad you're feeling inspired! Why don't you give one of these humour exercises a try? You never know what you might come up with! I'm rooting for you!,0,0
Check out these humour exercises and pick one! ,I'm here to support you! Why don't you give one of these humour exercises a try?,0,0,0,0,Let's explore some humour exercises together! Which one of these seems the most interesting to you? I'm here to help guide you through whichever one you choose.,0,0
Have a go at one of the humour exercises! ,I'm so excited that you've decided to check out these humour exercises! What exercise would you like to try?,0,0,0,1,I'm so glad you're looking to try out the humour exercises! Here are some that you can start with - let's have some fun together! I'm here to help you out.,0,0
Try one of these humour exercises now! ,I encourage you to try one of the humour exercises!,0,0,0,0,I understand that this might be a bit challenging. I'm here to encourage you and offer my support. Why don't we start with one of these humour exercises and see how it goes? You can do this!,1,1
Take your pick of these humour exercises! ,I encourage you to give one of these humour exercises a try now!,0,0,0,0,I'm so glad you're ready to get creative and have some fun with humour! Here are some great exercises to choose from. Which one do you think you'd like to try first?,1,0
Test your humour and select an exercise!,Which of these humour exercises would you like to try?,0,0,0,0,I understand that you want to test your humour. Let me help you by suggesting some exercises. Why not try one and see how it goes? I am rooting for you!,0,0
Practicing humour will help you enhance your creativity. Congratulations!,See if you can find an exercise that makes you laugh!,0,0,0,0,I'm so glad you're taking this step to practice humour! Enhancing your creativity will help you in so many ways. You should be proud of yourself for taking this initiative! Keep it up - you got this!,1,1
Utilizing humour can help you increase your creativity - way to go!,Practicing humour can help you unlock your creative potential.,0,0,0,0,Great job! Humour can be a great tool to help boost your creativity. Let's keep exploring how humour can help us break out of our comfort zone and open up new possibilities. You've got this!,0,0
Humour can be a great tool for boosting your creativity - well done!,I'm so glad to hear that you're utilizing humour to help increase your creativity - great job!,0,0,0,0,Thank you for recognizing the power of humour in boosting creativity! It is truly a great tool to use when looking for fresh ideas and perspectives. I'm so glad that you are taking the time to explore this domain. Keep up the good work!,1,1
Humour is the key to improving your creative skills - bravo!,I'm so glad to see that you're using humour as a way to enhance your creativity - great job!,0,0,0,0,Thank you for recognizing the importance of humour in developing creative skills! I'm so glad that you have made this realization. It's a great first step in the right direction. Let's work together to help you become a more creative and curious individual!,1,1
Humour can do wonders for your creative abilities - great job!,I'm so proud of you for recognizing that humour is an important factor in honing your creative skills!,0,0,0,0,Thanks for recognizing my efforts! I'm so glad that humour can help me with my creative abilities. I'll keep striving to get better at it. How can I continue to grow in this area?,1,1
Utilizing humour will aid in developing your creative skills - congrats!,I'm so impressed by how humour has enhanced your creativity - great job!,0,0,0,0,Thank you for recognizing the importance of humour in developing creative skills! I'm so glad you're taking this step towards building your creativity. It's an important and rewarding journey. Let's keep going!,1,1
Humour is the secret to unlocking your creative potential - fantastic!,I'm so glad to hear that you're working on developing your creative skills - using humour is a great way to do so! Congratulations!,0,0,0,0,It's great that you recognize the power of humour! It can be a great tool to help unleash your creativity.,0,0
Humour is the perfect way to enhance creativity - good job!,I'm so pleased that you've found humour to be the key to unlocking your creative potential!,0,0,0,0,Thank you for recognizing that humour can be a great way to boost creativity! I'm glad you're finding success in this exercise. Keep up the great work!,1,1
Practicing humour can help you sharpen your creative skills - congrats!,I'm so glad you used humour to enhance your creativity - that was a great decision!,0,0,0,0,Thank you for recognizing that humour can help with creativity! That's awesome! I'm so glad you've taken steps to sharpen your creative skills.,1,1
Making use of humour can help you elevate your creativity - yay!,I'm so proud of you for using humour to sharpen your creative skills!,0,0,0,0,Great! Humour can really be a great tool to help bring out your creative side. It can be a lot of fun to use humour to explore new ideas and perspectives.,0,0
Using humour can help you strengthen your creativity - awesome!,Using humor can be a great way to boost your creativity - how exciting!,0,0,0,0,I'm so glad to hear that you're looking to strengthen your creativity through humour! Humour can be a great tool to help us think outside the box and come up with creative solutions.,0,0
Taking advantage of humour can help you nurture your creativity - yippee!,I'm glad humour can help you strengthen your creativity - that's amazing!,0,0,0,0,Great! Humour is a wonderful tool to help you nurture your creativity. I'm so excited to hear that you're taking advantage of it!,0,0
Making humour a part of your life can help you with your creativity - congrats!,I'm so excited that using humour can help nurture your creativity!,0,0,0,0,Thank you for your kind words! I'm so glad you recognize the value of humour in creativity. It's a great way to inject fun and energy into your creative process. Let me know if there's any way I can help you further on your journey!,1,1
Making humour your friend can help you with your creative powers - good work!,I'm so glad that incorporating humour into your life has been beneficial for your creativity - congratulations!,0,0,0,0,I'm so glad to hear that you're making humour your friend! It's a great way to boost your creativity and explore your imagination. I'm proud of you for your hard work! Keep it up!,1,1
Incorporating humour into your life can help you with your creative abilities - great!,I'm so glad you're using humour to boost your creativity - great job!,0,0,0,0,"I'm so glad to hear that! Humour is such a great way to stay creative and curious. It can open up so many possibilities and help us think of ideas we wouldn't have thought of before. Plus, it can be really fun and lift our moods too!",0,0
Well done! Being more humorous will assist you in being creative!,It's wonderful that incorporating humour into your life can help you with your creative abilities!,0,0,0,0,Thank you so much for your effort! Humor is such an important part of creative expression and can really help open up our creative channels.,0,0
Impressive! Becoming wittier will give you a boost in creativity!,I'm so impressed that you're putting effort into being more humorous! Doing so will help you tap into your creativity.,0,0,0,0,That's wonderful! Developing your wit will open you up to new and exciting possibilities. I'm sure it will help you explore your creativity in a whole new way.,0,0
Marvelous! Becoming more humorous will help to promote your creativity!,That's great! Strengthening your wit can help you to unleash your creativity!,0,0,0,0,That's great to hear! It's really important to foster creativity and humour! It can help you look at things in different ways and can open up new possibilities.,0,0
Way to go! Becoming more humorous will aid in developing your creativity!,I'm so glad to see you're developing your humorous side! Becoming more humorous can really help foster your creativity.,0,0,0,0,I'm so proud of you! Developing your sense of humor will give you the opportunity to explore and expand your creativity. It's a great way to open up new possibilities!,0,0
Bravissimo! Becoming more humorous will help you foster creativity!,I'm so proud of you for taking the initiative to work on becoming more humorous - it will help to cultivate your creativity!,0,0,0,1,Great job! Becoming more humorous can be a great way to foster creativity and it can be a lot of fun too. ,0,0
Superb! Becoming more humorous will help you cultivate creativity!,I'm so impressed! Becoming more humorous can help you unlock your creativity!,0,0,0,0,That's great news! It's wonderful that you're looking to cultivate creativity through humor. Let's work together to make this a reality. What can I do to help you?,0,0
Kudos! Becoming more humorous will help you foster creativity!,I'm so glad you're working on becoming more humorous! It's a great way to help cultivate your creativity!,0,0,0,0,"Great job! You're taking an important step towards unlocking your creative potential by working on your humour. Having a sense of humour is an invaluable skill that will help you in many ways. It's an exciting journey, and I'm here to help you every step of the way.",1,1
Nice work! Becoming more humorous will help you become more imaginative!,I'm so glad you're working on becoming more humorous! It's a great way to foster creativity and I'm sure it will be beneficial for you.,0,0,0,0,"Great job! Becoming more humorous can help you develop your imagination in amazing ways. Plus, it can be a lot of fun!",0,0
Well done! Becoming more humorous will aid you in being creative!,I'm so impressed by your work! Becoming funnier can help to foster your creativity!,0,0,0,0,Congratulations! You have taken a great step towards becoming more creative. Developing a sense of humour can help you express yourself in a more creative way. I'm sure you will enjoy the process!,1,1
Great job! Becoming more humorous will help you become creative!,I'm so impressed that you are developing your sense of humor! It can really help to unlock your creativity.,0,0,0,0,"I'm so glad to see you taking your creativity and humour to the next level! You're already doing a great job, so keep it up! I'm sure it'll be a great journey and you'll be successful.",1,1
Bravo! Becoming more humorous will help you cultivate creativity!,I think it's wonderful that you put in the effort to become more humorous - it's a great way to help yourself become more creative!,0,0,0,0,That's great! Becoming more humorous can help you open up your creativity in so many different ways. I'm sure it will be a great experience for you.,0,0
Top notch! Becoming more humorous will aid your creativity!,I'm so proud of you for trying to become more humorous - it's a great way to cultivate creativity!,0,0,0,0,Great job! Developing your sense of humor can really help to cultivate your creativity. Let's keep going!,0,0
Outstanding! Becoming more humorous will help you generate creativity!,I'm so glad you're looking to become more humorous! It can be a great way to boost your creativity!,0,0,0,0,That's great! Developing your humour will help you unlock new levels of creativity. Let's keep going!,0,0
Splendid! Becoming more playful will help you cultivate creativity!,That's wonderful! Becoming more humorous can help you open up your creativity!,0,0,0,0,That's wonderful! Taking time to be more playful will help you foster creativity and unleash your curiosity. It's an amazing way to explore new ideas and tap into your imagination.,0,0
Congrats! Becoming more humorous will help you become creative!,I'm so excited for you that becoming more playful will help you cultivate creativity!,0,0,0,0,It's wonderful to hear that you are looking to become more humorous and creative! I am here to help you on your journey.,0,0
Good job. Would you like to try another exercise in the Humour category?,I'm so glad you're becoming more humorous - it will open up so many creative opportunities for you!,0,0,0,0,Great work! Is there another exercise in the Humour domain that you would like to try? I'm here to help you.,0,0
Nicely done! Fancy having a go at another exercise in the Humour section?,You did a terrific job! Would you be interested in attempting another exercise in the Humour category?,0,0,0,0,Great job! Are you interested in exploring another exercise in the Humour domain? I'm here to help you with that if you need it!,0,0
