sentences,empathetic_rewriting,empathy_score_2ft,empathy_score_2FT,empathy_score_2FT_sentence,empathy_score_triple,empathetic_rewriting_new,NEWempathy_score_triple,NEWempathy_score_2
"Humor is crucial for creativity as it encourages a humorous outlook, propels out-of-the-box thinking, and creates a chill atmosphere where innovative thoughts can take shape. This practice is mainly drawn from the Incongruity Theory - we laugh when something funny violates our common belief, e.g., in the punchline of a joke (Aristotle, Kant, Schopenhauer).","It can be incredibly beneficial to have a sense of humor in order to foster creativity, as it promotes a light-hearted approach and encourages out-of-the-box thinking, creating an environment in which new ideas can grow. This concept is rooted in the Incongruity Theory - when something seemingly insignificant contradicts our common understanding, we often find it amusing, such as the punchline of a joke (Aristotle, Kant, Schopenhauer).",0,0,0,0,"Absolutely! Humor can be a great source of creativity. It can help us to think outside the box and create an environment where creative ideas can thrive. Plus, it's backed up by the Incongruity Theory - when something funny breaks the norm, it can be very amusing.",0,0
"Being funny is important for creativity since it encourages a jovial attitude, motivates creative reasoning, and makes a atmosphere where imaginative ideas can thrive. This practice is largely based on the Incongruity Theory - we laugh when something light-hearted disregards our common belief, like the finale of a joke (Aristotle, Kant, Schopenhauer).","Humor can be a powerful tool for fostering creativity, as it can foster a humorous outlook, inspire out-of-the-box thinking, and create a relaxed atmosphere where innovative ideas can take shape. This is often based on the Incongruity Theory, which states that we laugh when something funny clashes with our expectations - such as the punchline of a joke (Aristotle, Kant, Schopenhauer).",0,0,0,0,It's great that you recognize the importance of humor in creativity! It can help us think outside the box and come up with creative solutions. Have you tried incorporating humor into your creative process? It's a great way to come up with new ideas. Why not give it a try?,0,0
"Having a sense of humor is fundamental for creativity as it inspires a playful attitude, encourages out-of-the-ordinary thinking, and builds a relaxed environment where inventive thoughts can germinate. This practice is largely drawn from the Incongruity Theory - we laugh when something that isn't serious contradicts our common belief, such as the ending of a joke (Aristotle, Kant, Schopenhauer).","I understand that being funny is an important form of creativity, as it can help to create a lively atmosphere that encourages creative thinking and allows imaginative ideas to flourish. This is largely based on the Incongruity Theory, which states that a humorous situation can arise from when something unexpected challenges our preconceived notions, like the ending of a joke (Aristotle, Kant, Schopenhauer).",0,0,0,0,"I'm glad you're interested in exploring the benefits of a sense of humor! Incongruity Theory suggests humor can spark creative thinking. To practice, why not try writing a few jokes to see how this theory applies? Have fun, and remember to keep an open mind when coming up with ideas!",0,0
"Humor is necessary for creativity as it encourages a jocular mindset, motivates unconventional pondering, and creates a laid-back atmosphere where inventive ideas can blossom. This practice is mostly based on the Incongruity Theory - we laugh when something non-serious defies our common belief, like the punchline of a joke (Aristotle, Kant, Schopenhauer).","Having a sense of humor is incredibly important for creativity as it can foster a lighthearted atmosphere, which can encourage creative thinking and innovative solutions. This concept is drawn from the Incongruity Theory, which explains how we often find humor in things that contradict our beliefs, such as the punchline of a joke (Aristotle, Kant, Schopenhauer).",0,0,0,0,"Sure, humor can be great for creativity! It can help you to relax, think outside the box, and come up with unique ideas. Let's put the Incongruity Theory to the test - why don't you try writing a joke to see how it works? Have fun and see what you come up with!",0,0
"Being humorous is essential for creativity since it encourages an imaginative outlook, propels off-the-wall thinking, and makes a atmosphere where fresh ideas can take root. This practice is largely drawn from the Incongruity Theory - we laugh when something seemingly insignificant violates our common belief, e.g., in the conclusion of a joke (Aristotle, Kant, Schopenhauer).","The Incongruity Theory suggests that humor can be a great tool for creativity, as it can inspire us to think differently and make us feel more relaxed. This can be seen in how we laugh when something unexpected or unusual contradicts our expectations, such as the punchline of a joke. In this way, humor can help to motivate unconventional pondering and foster an atmosphere where inventive ideas can thrive.",0,0,0,0,"Absolutely! Humor can be a great way to break down barriers and foster creativity. It helps us look at things from a new perspective and can be the spark for inventive solutions. Plus, it creates a fun and positive environment for new ideas to take hold. It's all based on the Incongruity Theory - when something surprising happens, it can make us laugh. That's why jokes are so popular!",0,0
"Humor encourages a fun outlook, stimulates out-of-the-box thinking, and creates a laid-back environment where new ideas can thrive. These exercises are based on the theory that revolves around incongruity - we chuckle when something off the wall contradicts our typical beliefs, like in the punchline of a joke (Aristotle, Kant, Schopenhauer).","It can be so beneficial to be humorous since it can help foster an open-minded outlook, encourage out-of-the-box thinking, and create a positive environment where new ideas can be explored. This concept is based on the Incongruity Theory, which states that we laugh when something unexpected interrupts our expectations, for example, the punchline of a joke (Aristotle, Kant, Schopenhauer).",0,0,0,0,"Sure, humor stimulates creativity and helps us come up with new ideas. Here's an exercise to get your creative juices flowing - let's explore the concept of incongruity and how it affects our laughter. Together, let's figure out how Aristotle, Kant, and Schopenhauer's theories fit into this idea.",0,0
"Being humorous builds a playful attitude, encourages imaginative thinking, and makes a comfortable atmosphere where creative ideas can blossom. The following exercises are rooted in the idea based on the Incongruity Theory - we laugh when something unusual goes against our expectations, for example in the ending of a joke (Aristotle, Kant, Schopenhauer).","Humor can be a great way to encourage a fun outlook, stimulate creative thinking, and create an atmosphere of openness and acceptance where new ideas can be explored without judgement. The underlying theory of humor, which is based on the concept of incongruity, is that we often find amusement in things that contradict our usual beliefs - just think of the punchline of a joke! This is something that has been discussed by philosophers such as Aristotle, Kant, and Schopenhauer.",0,0,0,0,It sounds like you want to foster an atmosphere that encourages creativity. Laughter can be a great way to do that! Have you ever heard of the Incongruity Theory? It suggests that we laugh when something is unexpected. Why not give it a try with some jokes? Here are some exercises to get you started.,0,0
"Laughing and playing around cultivates an enjoyable mentality, provokes original thought, and establishes a calm setting where creativity can grow. These exercises are rooted in the Incongruity Theory - we giggle when something unexpected clashes with our ordinary assumptions, like in the punchline of a joke (Aristotle, Kant, Schopenhauer).","Creating a sense of humor can foster a lighthearted attitude, inspire imaginative thinking, and create an inviting atmosphere where innovative ideas can thrive. This concept draws on the Incongruity Theory - when something unexpected happens, it can spark a laugh (Aristotle, Kant, Schopenhauer).",0,0,0,0,"I'm so glad you're interested in exploring Incongruity Theory! Laughing and playing around can help us nurture an enjoyable mindset, and foster a relaxed environment where creativity can blossom. Let's try out some exercises to help us understand the theory better. It's based on the idea that we laugh at something unexpected that goes against our normal expectations, like a joke's punchline. Sounds fun, right?",1,1
"Having a sense of humor encourages a playful  attitude, promotes unorthodox pondering, and sets up a comfortable atmosphere where inspiring ideas can take root. These exercises are based on the Incongruity Theory - we laugh when something non-serious contradicts our usual beliefs, such as in the punchline of a joke (Aristotle, Kant, Schopenhauer).","Engaging in laughter and play can cultivate a positive mindset, encourage creative thinking, and create a peaceful atmosphere for creativity to blossom. This concept is based on the Incongruity Theory, which suggests that when something unexpected clashes with our established beliefs, like the punchline of a joke, we often find ourselves amused (Aristotle, Kant, Schopenhauer).",0,0,0,0,"Absolutely! Humor is a great way to open up our minds to new ways of thinking, and these exercises can help us explore the Incongruity Theory. Why don't we dive right into it? Shall we start with Aristotle, Kant, and Schopenhauer?",0,0
"Humor stimulates a cheerful demeanor, encourages out-of-the-ordinary thinking, and creates a relaxed environment where innovative concepts can thrive. These exercises are based on the Incongruity Theory - we smile when something quirky goes against our common perception, like in the punchline of a joke (Aristotle, Kant, Schopenhauer).","Developing a sense of humor can help create a positive environment where we can look at things from a different perspective, be open to new ideas, and feel comfortable enough to explore and express our thoughts. According to the Incongruity Theory, humor often arises when the unexpected happens and our expectations are challenged - like the punchline of a joke.",0,0,0,1,"Great! Humor can be a great way to make your environment more relaxed and creative. Here’s an exercise based on Incongruity Theory. It focuses on how we smile when something unexpected happens, like the punchline of a joke. Have fun with it!",0,0
"Humour encourages a playful outlook, encourages inventive thinking, and establishes a peaceful setting where inventive ideas can take hold. These exercises are derived from the Incongruity Theory - we chuckle when something strange violates our standard beliefs, as in the punchline of a joke (Aristotle, Kant, Schopenhauer).","It's no surprise that humor can have a positive effect on our mood, help us think outside the box, and create a more relaxed atmosphere where creative ideas can grow. According to the Incongruity Theory, our smiles are often triggered when something unexpected occurs, such as the punchline of a joke (Aristotle, Kant, Schopenhauer).",0,0,0,0,"Sure, humour can be a great way to open up our minds and have a more positive outlook! Exercises based on the Incongruity Theory can help explore this further - think of it like a way to come up with creative solutions by looking at things in a different way. Let's take a look at how this theory works by looking at jokes!",0,0
"Being humorous develops a playful attitude, inspires creative pondering, and forms a comfortable atmosphere where new ideas can flourish. These exercises originate from the Incongruity Theory - we laugh when something offbeat clashes with our usual notions, such as in the punchline of a joke (Aristotle, Kant, Schopenhauer).","Humour can bring us together by encouraging a lighthearted outlook, stimulating creative thinking, and fostering a peaceful environment where new ideas can be explored. The Incongruity Theory suggests that we often find something humorous when it contradicts our expectations, such as the punchlines of jokes (Aristotle, Kant, Schopenhauer).",0,0,0,0,Sure thing! Humor can be a great way to boost creativity and create an environment that's conducive to exploring new ideas. Here are some exercises from the Incongruity Theory to get you started. See if you can come up with something that's unexpected or unexpected to get a laugh - like the punchline of a joke!,0,0
"Having a sense of humor promotes a playful  attitude, encourages offbeat thinking, and shapes a comfortable setting where pioneering concepts can take shape. These exercises are based on the Incongruity Theory - we laugh when something out of the ordinary goes against our common belief, like in the punchline of a joke (Aristotle, Kant, Schopenhauer).","The Incongruity Theory suggests that humor is born from the clash between unexpected events and our usual expectations, like the punchline of a joke. By bringing this playful attitude into conversations, we can inspire creativity, foster a supportive environment for new ideas to grow, and enjoy some light-hearted moments along the way.",0,0,0,0,"I'm glad to hear you're interested in the Incongruity Theory. It's an interesting concept! To better understand it, why don't we explore it further? We can start by looking at some examples of the Theory, such as punchlines of jokes. This will help us better understand how humor can promote a playful attitude and offbeat thinking. Sound good?",0,1
"Humor encourages a playful disposition, fosters unconventional thinking, and creates a comfortable atmosphere where new ideas can take flight. These exercises are based on the Incongruity Theory - we laugh when something different contradicts our ordinary assumptions, as in the punchline of a joke (Aristotle, Kant, Schopenhauer).","It is through having a sense of humor that we can create an atmosphere of playfulness, foster creative thinking, and create a comfortable space for innovative ideas to develop. This is based on the Incongruity Theory, which suggests that our funny bone is tickled when the unexpected occurs, like when the punchline of a joke goes against our expectations (as seen in the works of Aristotle, Kant, and Schopenhauer).",0,0,0,0,Great! Humor can be a great way to help us think outside of the box. These exercises use the Incongruity Theory to help us explore our assumptions and expectations. Why not give it a try and see what new ideas you can come up with?,0,0
"Having a humorous outlook encourages a playful attitude, stimulates imaginative thought, and forms a relaxed environment where inventive notions can sprout. These exercises are derived from the Incongruity Theory - we laugh when something out of the ordinary clashes with our typical beliefs, for example in the punchline of a joke (Aristotle, Kant, Schopenhauer).","Humor encourages us to be playful and think outside the box, creating an atmosphere of comfort and openness that enables us to explore new ideas. This is based on the Incongruity Theory, which suggests that we laugh when something unexpected and different occurs - like the punchline of a joke - according to Aristotle, Kant, and Schopenhauer.",0,0,0,0,I understand that having a humorous outlook can be a great way to stimulate creative thinking and encourages a relaxed environment. Incongruity Theory is a great way to understand why something might be funny. Why don't we try some exercises to see how we can apply this theory? Let's have some fun and see what we can discover!,0,0
" Being humorous fosters a lighthearted state of mind, promotes original thinking, and makes a peaceful atmosphere where innovative ideas can grow. These exercises are rooted in the Incongruity Theory - we laugh when something off the wall goes against our expectations, like in the punchline of a joke (Aristotle, Kant, Schopenhauer).","Having a humorous outlook can help create a positive atmosphere, stimulate creative thinking, and lead to a relaxed space where new ideas can be explored. Through the Incongruity Theory, we can understand why we laugh when something unexpected happens - like the punchline of a joke - and how it contrasts with our regular beliefs (as shown by Aristotle, Kant, and Schopenhauer).",0,0,0,1,"Great! Humor can be a powerful tool to help foster creativity. Let's start by exploring the Incongruity Theory. Can you think of any situations where something unexpected or off the wall caused you to laugh? What was it about the situation that made it funny? After we reflect on this, let's take a look at some of the famous philosophers and their take on humor.",1,0
"Humor develops a playful outlook, encourages out-of-the-ordinary thought, and creates a laid-back environment where inspiring concepts can take root. These exercises are based on the Incongruity Theory - we laugh when something offbeat violates our usual assumptions, as in the punchline of a joke (Aristotle, Kant, Schopenhauer).","It's no secret that humor can be incredibly beneficial to our mental state, by promoting original thinking and creating a peaceful atmosphere where ideas can be developed. Incongruity Theory provides us with an explanation behind why this is - we often laugh when something unexpected takes place, which is typically the case in the punchline of a joke (Aristotle, Kant, Schopenhauer).",0,0,0,0,"Yes, humor is a great way to bring some lightness to the environment. The Incongruity Theory explains why we laugh when something unexpected happens. Why don't we try some of these exercises to explore this idea further?Ready to give it a go?",0,0
"Possessing a sense of humor encourages a playful mentality, stimulates creative pondering, and shapes a relaxed setting where ingenious ideas can thrive. These exercises revolve around incongruity - we laugh when something unexpected goes against our common perception, like in the punchline of a joke (Aristotle, Kant, Schopenhauer).","Humor can foster a jovial attitude, stimulate creative thinking, and create a relaxed environment in which original ideas can be explored. According to the Incongruity Theory, we often find ourselves laughing when something unexpected goes against our expectations, such as the punchline of a joke (Aristotle, Kant, Schopenhauer).",0,0,0,0,"I'm so glad you're exploring the concept of humor! It sounds like a great way to open up creative thought and foster a relaxed setting. Here's a fun exercise to get you started: let's explore incongruity, or the idea that we laugh when something unexpected goes against our common perception. For example, the punchline of a joke like Aristotle, Kant, Schopenhauer.",0,0
"Having a humorous outlook builds a playful attitude, encourages imaginative thinking, and establishes a comfortable atmosphere where pioneering notions can bloom. These exercises are derived from the Incongruity Theory - we laugh when something non-serious clashes with our typical beliefs, such as in the punchline of a joke (Aristotle, Kant, Schopenhauer).","Having a sense of humor can create an environment where creative thought and innovation can flourish. It can provide a playful, relaxed atmosphere where unexpected moments can bring a smile and inspire innovative ideas. As Aristotle, Kant, and Schopenhauer noted, humor is often based on perceiving something incongruous and unexpected, like the punchline of a joke.",0,0,0,0,"Sure, having a humorous outlook can have lots of benefits. Why don't we explore these benefits together with some fun exercises? We can use the Incongruity Theory to explore how humour works - let's see what unexpected twists we can find! Sounds like a plan?",0,0
"Being humorous encourages a playful mindset, fosters creative pondering, and forms a calm setting where new ideas can take hold. These exercises are based on the Incongruity Theory - we laugh when something unusual contradicts our ordinary assumptions, like in the punchline of a joke (Aristotle, Kant, Schopenhauer).","Having a humorous outlook can help foster an atmosphere where it is safe to explore new ideas and express imaginative thinking. By creating a sense of playfulness and comfort, we can open ourselves up to the unexpected, allowing for our incongruous beliefs to be reconciled - like in the punchline of a joke (Aristotle, Kant, Schopenhauer).",0,0,0,0,Great! Humor can be a great way to foster creativity and positivity. Let's explore the Incongruity Theory so you can start to think outside the box. Would you like to try some exercises based on this theory?,0,0
Here you can find some exercises to help you practice humour.,"Laughter is often an unexpected and delightful surprise that can help us foster creativity and creative thinking. By allowing ourselves to experience the joy of a humorous moment, we can create a relaxed atmosphere where new and innovative ideas can take root. This is based on the Incongruity Theory, which states that humor is created when something unexpected contradicts our normal expectations, such as the punchline of a joke (Aristotle, Kant, Schopenhauer).",0,0,0,1,Great! Exercises can be a great way to practice humour. Why not start by trying out a few to get comfortable? You can even have some fun with them!,0,0
Discover a collection of exercises below that can assist you in honing your sense of humor.,I hope these exercises can help you practice humour and get more comfortable expressing yourself.,0,0,0,0,Sure thing! Here's a collection of exercises to help you sharpen your funny bone. Let's get started!,0,0
Here you can do some exercises to hone your humour.,We've compiled a selection of exercises below that can help you develop your sense of humor.,0,0,0,0,Sure! Let's do some exercises together to help you hone your humour. It's a fun way to build up your comedic skills. Shall we get started?,0,0
Here you can find some drills to sharpen your sense of humour.,I hope that these exercises help you become better at expressing your humour.,0,0,0,0,I'm glad you're looking to work on your humour! Here are some great exercises to help you out: give them a try and you'll see your wit improve in no time. Good luck!,0,0
Here you can attempt some workouts to develop your sense of humour.,I hope these drills can help you develop a better sense of humour.,0,0,0,0,Great! A sense of humour can be a great asset. Let's get started! Here are a few exercises to help you build your humour skills - why don't you give them a try?,0,0
Here you can try out some activities to help you work on your wit.,I hope these workouts help you develop your sense of humour.,0,0,0,0,I'm here to help you grow your wit! Would you like to try out a few activities that can help you with that? It'll be fun!,0,0
Here you can engage in some exercises to cultivate your humour.,Here are some activities that can help you sharpen your wit.,0,0,0,0,Sure! Let's get started. What type of exercise would you like to do first? I'm here to help you along the way.,0,0
Here you can do some exercises to refine your ability to laugh.,Here you can explore some activities to help you develop your sense of humour.,0,0,0,0,Sure! Exercises are a great way to enhance your sense of humour. Why don't we start with a few easy ones to get you going? Let's do it!,0,0
Here you can practice some routines to enhance your ability to laugh.,Here you can practice exercises that can help you feel more comfortable with laughing.,0,0,0,0,Great! Let's start. I can help you to explore some fun exercises to help you laugh more. What do you think?,0,0
Here you can perform some tasks to boost your humour.,Here you can try out some exercises to help you cultivate a more joyful sense of humor.,0,0,0,0,Great! Let's start with some exercises that will help you get into a better mood. What do you think would help you the most?,0,0
Here you can practice some drills to increase your humorous side.,I hope these tasks help bring a smile to your face.,0,0,0,0,Great! Exercising your funny side can be really enjoyable. Why don't we start with some fun warm-up drills? Then we can move on to more difficult ones. Sound good?,0,0
Here you can take on some workouts to add to your funny bone.,You can use these drills to help develop your sense of humor.,0,0,0,0,Great! I'm glad to help you out. Let's start with some exercises to help you add to your funny bone. Shall we?,0,0
Here you can take part in some activities to strengthen your funny side.,Here you can find some workouts to help you to have some fun!,0,0,0,0,Great! It's important to have a good sense of humor. Let's start with some activities that will help sharpen your funny side. Ready to give it a try?,0,0
Here you can practice some exercises to upgrade your humour.,We can offer you some activities here that can help to bring out your inner sense of humor.,0,0,0,0,Great! Exercising your humour is a great skill to have. Shall we start? What kind of exercises would you like to practice?,0,0
Here you can do some drills to improve your sense of humour.,I hope these exercises will help you to enhance your sense of humour.,0,0,0,0,Great! Let's work on improving your sense of humour. I'm here to help guide you through some fun exercises that will help you out. Ready to try it out?,0,0
Here you can participate in some routines to expand your sense of humour.,I hope these drills help you to strengthen your sense of humour.,0,0,0,0,I'm glad you're interested in expanding your sense of humour! Here are some fun activities that can help you do this. Why don't you give them a try?,0,0
