sentence,empathy_score
"I completely understand how important humor can be in terms of creativity. These exercises are tailored to help you exercise your humorous thinking. It's great to know that these exercises are based on the Self-Initiated Humour Protocol, rooted in humour theory and self-attachment technique. Let's get started!",1
"I completely understand how humor can be essential for creativity and the importance of creating a relaxed environment for innovative ideas. The exercises below are designed based on Self-Initiated Humour Protocol, rooted in humour theory and self-attachment technique. I'm here to help you every step of the way. Let's get started!",0
"I completely understand how valuable humor is when it comes to creativity. It can be so helpful in creating a positive atmosphere, encouraging us to think outside the box. The following exercises are based on Self-Initiated Humour Protocol, rooted in humour theory and self-attachment technique. It's amazing how humor can be so powerful and I'm sure it can help us come up with great ideas.",0
"It can be difficult being creative and humorous at the same time. But don't worry, it's definitely possible! I'm here to help you through it. Self-Initiated Humour Protocol, rooted in humour theory and self-attachment technique, is the foundation for these exercises. This will help you cultivate a playful and whimsical attitude which is essential to developing creative thoughts. With a relaxed environment, you can explore different pondering and be creative!",0
"I completely understand how having a sense of humor can help to be creative. Humor allows us to step back from our common beliefs and look at things from a different perspective. This can help us to think of new ideas and come up with unconventional solutions. It also creates an enjoyable environment where new and creative thoughts can thrive. Self-Initiated Humour Protocol, rooted in humour theory and self-attachment technique, is the foundation for these exercises.",0
"I am told humor is an essential element for creativity. It can help us look at things from a different perspective and come up with innovative ideas. It also creates a relaxed atmosphere that encourages unconventional thinking. And I know that Self-Initiated Humour Protocol, rooted in humour theory and self-attachment technique, can help with this. ",0
"I understand how important a sense of humor is for creativity. It can help foster a playful attitude, boost creative thinking, and create an atmosphere that is conducive to generating innovative ideas. How wonderful is it that Self-Initiated Humour Protocol, rooted in humour theory and self-attachment technique, is a basis for this practice? It is amazing that laughter can help us be more innovative!",0
"I completely understand how important humor is for creativity! A playful mindset and innovative pondering are so essential to unlocking new ideas. And I think it's awesome that humor can help create a relaxed atmosphere for these ideas to form! It's really interesting to learn this from the Self-Initiated Humour Protocol, rooted in humour theory and self-attachment technique.",1
"I understand that having a sense of humour is really important for being creative. A playful attitude, thinking outside the box and creating a welcoming environment for new ideas are all part of the Self-Initiated Humour Protocol, rooted in humour theory and self-attachment technique. I'm here to help you find ways to use humour to your advantage and explore the possibilities of creativity.",0
"I completely understand how humour can be an important tool for creativity. It can really help to create a relaxed atmosphere that allows us to think outside of the box. Humour also allows us to challenge our preconceived notions and beliefs, which can lead to some interesting results. It is great that the Self-Initiated Humour Protocol, rooted in humour theory and self-attachment technique, provides some insight into why we find humour in certain situations.",1
"I understand that being funny is a great way to promote creative thinking. It helps to create a positive and open atmosphere where new ideas can be explored. It is interesting to note that this approach is based on the Self-Initiated Humour Protocol, rooted in humour theory and self-attachment technique - we can learn to be more humorous in various situations in life. ",1
"I understand that having a sense of humour is important for creativity. It helps us to think outside the box and can create a relaxed atmosphere which is conducive to developing new ideas. The Self-Initiated Humour Protocol, rooted in humour theory and self-attachment technique, is a great way to understand this, as it teaches us how humour can be practiced.",0
"I understand how important humor is for creativity! It can help to lighten the atmosphere, allowing us to think outside of the box and come up with creative ideas. It seems like the Self-Initiated Humour Protocol, rooted in humour theory and self-attachment technique, is a great way to explain how humor works - and you can learn to laugh more often with these exercises!",0
"I completely understand how important humour is for creativity. It opens up a world of new possibilities and allows us to think differently. Luckily, these exercises are based on the Self-Initiated Humour Protocol, rooted in humour theory and self-attachment technique; it's a great way to understand why humour is so important. It's fascinating to think that something really simple can make us laugh and it's amazing how the humour theories have been around for centuries.",0
I understand that humor can be a great tool for creativity and out-of-the-box thinking. It's wonderful that you are happy to incorporate this into your exercise! I'm sure it will create a positive atmosphere that encourages new ideas to thrive. I'm here to support you in any way I can.,1
"I completely understand how difficult it can be to dive into humour and creative exercises. However, humour is a great way to foster creativity and develop an environment of comfort - it's an invaluable skill to have! These exercises are based on the Self-Initiated Humour Protocol, rooted in humour theory and self-attachment technique - helping us to laugh at any situation every day. It's a fun way to explore our creativity and imagination. Let's get started!",1
"I understand how important it is to have a creative and fun environment in order to grow and be productive. Great news - these exercises are based on the Self-Initiated Humour Protocol, rooted in humour theory and self-attachment technique. I'm glad, because this protocol can be used to stimulate creativity! I'm here to help guide you through exercises that will help you cultivate an enjoyable mentality and provoke original thought. Let's start exploring and see how we can bring humour into your work.",0
"It sounds like humor can really help us get our creative juices flowing! These exercises are based on the Self-Initiated Humour Protocol, rooted in humour theory and self-attachment technique - it's a great way to think outside the box and come up with unique ideas. I'm sure it'll be a fun experience for us to explore the humorous side of things. Let's get started!",0
"Humor can be an incredibly powerful tool to foster a positive environment and allow for creative thinking. It's great that these exercises are based on the Self-Initiated Humour Protocol, rooted in humour theory and self-attachment technique - it helps us to appreciate the unexpected surprises and unique perspectives in life. I'm sure that by using these exercises, we can develop an open-minded atmosphere that encourages innovative ideas.",0
"I understand that humour can help us look at things in a creative and different way. It can also be a great way to create a positive and relaxed atmosphere for us to come up with new ideas. These exercises are based on the Self-Initiated Humour Protocol, rooted in humour theory and self-attachment technique, which explains how we can practice our sense of humour to aid our daily life. That's really interesting!",0
"I understand that humour can be an important tool for creative thinking and forming a relaxed atmosphere. It's amazing that these exercises are based on the Self-Initiated Humour Protocol, rooted in humour theory and self-attachment technique. Let's explore some ways to nurture that playful attitude and use humour to foster creative thinking. Would you like to start now?",0
"I understand how intimidating it can be to think about exploring new ways of thinking. But I'm here to support you through this journey. Our exercises are designed to help you cultivate your sense of humour and think outside the box. Even though the exercises are based on the Self-Initiated Humour Protocol, rooted in humour theory and self-attachment technique, there's no need to worry - you will be guided every step of the way. ",1
"I can understand that this type of exercises can be challenging and intimidating. Let me assure you that humour is a great way to explore creative thinking. It helps us to look at things from a different perspective and allows us to think outside the box. It can also help us to create a relaxed and friendly atmosphere which is conducive to the generation of new ideas. I'm here to help you explore some exercises from the Self-Initiated Humour Protocol, rooted in humour theory and self-attachment technique, and find humour in everyday situations.",0
"I completely understand how daunting it can be to explore your creative side. Let me help you get started with a few exercises that will make it easier and more fun. The exercises are based on the Self-Initiated Humour Protocol, rooted in humour theory and self-attachment technique, which teaches us how we can practice humour for every day situations.",0
"I understand how important it is to have a lighthearted and creative atmosphere. These exercises are designed to help us think outside of the box and find humor in unexpected places, based on the Self-Initiated Humour Protocol, rooted in humour theory and self-attachment technique. I'm here to help you explore these exercises, and find the humor in the unexpected!",0
"I understand how important humor is in developing creativity and thought. It can feel daunting to work on such an abstract concept. Don't worry, I'm here to help! These exercises are based on the Self-Initiated Humour Protocol, rooted in humour theory and self-attachment technique. It's okay if you don't quite get it at first. We can take it step-by-step and explore the concept together.",1
"I totally understand how important having a sense of humor is! It can really help to create a fun and relaxed atmosphere where new and creative ideas can flourish. Worry not - these exercises are based on the Self-Initiated Humour Protocol, rooted in humour theory and self-attachment technique, helping you discover humour in everyday situations. It's definitely a great way to expand our creativity and experience life in a different way!",0
"I understand that humour can be a great way to open the doors to creative and curious thinking. It can help create an environment that encourages people to come up with new ideas. Great news - these exercises are based on the Self-Initiated Humour Protocol, rooted in humour theory and self-attachment technique, which will help your ability to laugh every day!",0
"I'm so glad to hear that you're interested in developing your creativity and humor! Humor helps us be more creative and it can be a great way to relax and let new ideas flow. These exercises are based on the Self-Initiated Humour Protocol, rooted in humour theory and self-attachment technique, which can help us learn to laugh in every day situations. It's amazing how even in the ancient times, great minds were already on the right track about how humour works!",1
